,title,Directed by,Story by,Based on,Produced by,Music by,Production company,Distributed by,Release dates,Running time,Country,Language,Budget,Box office,Running time(int),Box office(float),Budget(float),Release date (Datetime),IMDb rating,Meta Score,Rotten Tomatoes (%),Starring,Cinematography,Release date,Written by,Edited by,Languages,Narrated by,Screenplay by,Adaptation by,Countries,Color process,Genre,Created by,Country of origin,No.  of seasons,No.  of episodes,Executive producers,Network,Release,Production companies,Original language,Producer,Developed by,Voices of,Theme music composer,Opening theme,Ending theme,Composer,Producers,Editor,Kanji,Transcriptions,Revised Hepburn,Traditional Chinese,Simplified Chinese,Literal meaning,Original title,Layouts by
0,Snow White and the Seven Dwarfs,"['Supervising Directors', 'David Hand', 'Sequence Directors', 'Perce Pearce', 'William Cottrell', 'Larry Morey', 'Wilfred Jackson', 'Ben Sharpsteen']","Ted Sears, Richard Creedon, Otto Englander, Dick Rickard, Earl Hurd, Merrill De Maris, Dorothy Ann Blank, Webb Smith","['Snow White', 'by the', 'Brothers Grimm']",Walt Disney,"Frank Churchill, Leigh Harline, Paul Smith",Walt Disney Productions,RKO Radio Pictures,"December 21, 1937",83 minutes,United States,English,$1.5 million,$418 million,83.0,418000000.0,1500000.0,1937-12-21,7.6,96.0,N/A,,,,,,,,,,,,,,,,,,,,,,,,,,,,,,,,,,,,,,
1,Pinocchio,"Supervising Directors, Ben Sharpsteen, Hamilton Luske, Sequence Directors, Bill Roberts, Norman Ferguson, Jack Kinney, Wilfred Jackson, T. Hee","Ted Sears, Otto Englander, Webb Smith, William Cottrell, Joseph Sabo, Erdman Penner, Aurelius Battaglia","['The Adventures of Pinocchio', 'by', 'Carlo Collodi']",Walt Disney,"Leigh Harline, Paul J. Smith",Walt Disney Productions,RKO Radio Pictures,"February 7, 1940",88 minutes,United States,English,$2.6 million,$164 million,88.0,164000000.0,2600000.0,1940-02-07,7.5,99.0,100.0,"Cliff Edwards, Dickie Jones, Christian Rub, Walter Catlett, Charles Judels, Evelyn Venable, Frankie Darro",,,,,,,,,,,,,,,,,,,,,,,,,,,,,,,,,,,,,
2,Fantasia,"Samuel Armstrong, James Algar, Bill Roberts, Paul Satterfield, Ben Sharpsteen, David D. Hand, Hamilton Luske, Jim Handley, Ford Beebe, T. Hee, Norman Ferguson, Wilfred Jackson","Joe Grant, Dick Huemer",,"Walt Disney, Ben Sharpsteen",See plot,Walt Disney Productions,RKO Radio Pictures,,126 minutes,United States,English,$2.28 million,$76.4–$83.3 million ,126.0,76400000.0,2280000.0,1940-11-13,7.7,96.0,95.0,"Leopold Stokowski, Deems Taylor",James Wong Howe,"November 13, 1940 ",,,,,,,,,,,,,,,,,,,,,,,,,,,,,,,,,,,
3,The Reluctant Dragon,"['Alfred Werker', 'Hamilton Luske', 'Jack Cutting', 'Ub Iwerks', 'Jack Kinney']",,,Walt Disney,"['Frank Churchill', 'Larry Morey']",Walt Disney Productions,RKO Radio Pictures,,74 minutes,United States,English,"$600,000","$960,000  ",74.0,960000.0,600000.0,1941-06-27,6.7,N/A,100.0,"['Robert Benchley', 'Frances Gifford', 'Buddy Pepper', 'Nana Bryant']",Bert Glennon,"June 27, 1941 ","['Live-action:', 'Ted Sears', 'Al Perkins', 'Larry Clemmons', 'Bill Cottrell', 'Harry Clork', 'Robert Benchley', 'The Reluctant Dragon', 'segment:', 'Kenneth Grahame', 'Erdman Penner', 'T. Hee', 'Baby Weems', 'segment:', 'Joe Grant', 'Dick Huemer', 'John Miller']",Paul Weatherwax,,,,,,,,,,,,,,,,,,,,,,,,,,,,,,,,,
4,Dumbo,"Supervising director , Ben Sharpsteen, Sequence directors , Norman Ferguson, Wilfred Jackson, Bill Roberts, Jack Kinney, Samuel Armstrong","Joe Grant, Dick Huemer","['Dumbo, the Flying Elephant', 'by', 'Helen Aberson', 'Harold Pearl']",Walt Disney,"['Frank Churchill', 'Oliver Wallace']",Walt Disney Productions,RKO Radio Pictures,"October 23, 1941",64 minutes,United States,English,"$950,000",>$1.3 million ,64.0,1300000.0,950000.0,1941-10-23,7.2,96.0,95.0,,,,,,,,,,,,,,,,,,,,,,,,,,,,,,,,,,,,,,
5,Bambi,"['Supervising Director', 'David D. Hand', 'Sequence Director', 'James Algar', 'Bill Roberts', 'Norman Wright', 'Sam Armstrong', 'Paul Satterfield', 'Graham Heid']","['Perce Pearce', 'Larry Morey', 'George Stallings', 'Melvin Shaw', 'Carl Fallberg', 'Chuck Couch', 'Ralph Wright']","['Bambi, a Life in the Woods', 'by', 'Felix Salten']",Walt Disney,"['Frank Churchill', 'Edward Plumb']",Walt Disney Productions,RKO Radio Pictures,"August 9, 1942",70 minutes,United States,English,"$858,000",$267.4 million,70.0,267400000.0,858000.0,1942-08-09,7.3,91.0,91.0,,,,,,,,,,,,,,,,,,,,,,,,,,,,,,,,,,,,,,
6,Saludos Amigos,"Supervising Director, Norman Ferguson, Sequence Directors, Wilfred Jackson, Jack Kinney, Hamilton Luske, Bill Roberts","Homer Brightman, William Cottrell, Richard Huemer, Joe Grant, Harold Reeves, Ted Sears, Webb Smith, Roy Williams, Ralph Wright",,"['Walt Disney', 'Norm Ferguson']","Paul Smith, Edward H. Plumb",Walt Disney Productions,RKO Radio Pictures,"August 24, 1942",42 minutes,United States,,,$1 million  ,42.0,1000000.0,,1942-08-24,6.0,60.0,82.0,,,,,,"English, Portuguese, Spanish",,,,,,,,,,,,,,,,,,,,,,,,,,,,,,,,
7,Victory Through Air Power,"['Animated sequences:', 'James Algar', 'Clyde Geronimi', 'Jack Kinney', 'de Seversky scenes:', 'H.C. Potter']",,Victory Through Air Power by Maj. Alexander P. Seversky,Walt Disney,"['Edward H. Plumb', 'Paul J. Smith', 'Oliver Wallace']",Walt Disney Productions,United Artists,,65 min,United States,English,"$788,000","$799,000",65.0,799000.0,788000.0,1943-07-17,6.5,N/A,N/A,Alexander de Seversky,Ray Rennahan,"July 17, 1943 ","['Story direction:', 'Perce Pearce', 'Story adaptation:', 'T. Hee', 'Erdman Penner', 'Bill Cottrell', 'James Brodero', 'George Stallings', 'Jose Rodriguez']",Jack Dennis,,Art Baker,,,,,,,,,,,,,,,,,,,,,,,,,,,,,,,
8,The Three Caballeros,"Supervising Director: , Norman Ferguson, Sequence Directors: , Clyde Geronimi, Jack Kinney, Bill Roberts, Harold Young","Homer Brightman, Ernest Terrazas, Ted Sears, Bill Peet, Ralph Wright, Elmer Plummer, Roy Williams, William Cottrell, Del Connell, James Bodrero",,"['Walt Disney', 'Norman Ferguson']","Edward H. Plumb, Paul J. Smith, Charles Wolcott",Walt Disney Productions,RKO Radio Pictures,"December 21, 1944",71 minutes,United States,,,$3.355 million ,71.0,3355000.0,,1944-12-21,6.3,85.0,85.0,"Joaquin Garay, Clarence Nash, José Oliveira, Aurora Miranda, Carmen Molina, Dora Luz",,,,,"English, Spanish, Portuguese",,,,,,,,,,,,,,,,,,,,,,,,,,,,,,,,
9,Make Mine Music,"Jack Kinney, Clyde Geronimi, Hamilton Luske, Joshua Meador, Robert Cormack",James BodreroHomer BrightmanErwin GrahamEric GurneyT. HeeSylvia HollandDick HuemerDick KelseyDick KinneyJesse MarshTom OrebCap PalmerErdman PennerDick ShawHarry ReevesJohn WalbridgeRoy Williams,"['Casey at the Bat', 'by', 'Ernest Thayer', 'Peter and the Wolf', 'by', 'Sergei Prokofiev']","['Walt Disney', 'Joe Grant']","Eliot Daniel, Ken Darby, Charles Wolcott, Oliver Wallace, Edward Plumb",Walt Disney Productions,RKO Radio Pictures,"April 20, 1946",75 minutes,United States,English,$1.35 million,$3.275 million ,75.0,3275000.0,1350000.0,1946-04-20,6.1,60.0,58.0,"Nelson Eddy, Dinah Shore, Benny Goodman, Andrews Sisters, Jerry Colonna, Andy Russell, Sterling Holloway, David Lichine, Tania Riabouchinskaya, Lichine, Pied Piers, King's Men, Ken Darby's Chorus",,,,,,,,,,,,,,,,,,,,,,,,,,,,,,,,,,,,,
10,Song of the South,"Live action:, Harve Foster, Animation:, Wilfred Jackson",,"['Uncle Remus', 'by', 'Joel Chandler Harris']","['Walt Disney', 'Perce Pearce']","Daniele Amfitheatrof, Paul J. Smith",Walt Disney Productions,RKO Radio Pictures,"November 12, 1946",94 minutes,United States,English,$2.125 million,$65 million,94.0,65000000.0,2125000.0,1946-11-12,6.9,54.0,50.0,"Ruth Warrick, Lucile Watson, Hattie McDaniel, James Baskett, Bobby Driscoll, Luana Patten",Gregg Toland,,,William M. Morgan,,,"Live action:, Morton Grant, Maurice Rapf, Dalton S. Reymond, Animation:, Bill Peet, George Stallings, Ralph Wright",,,,,,,,,,,,,,,,,,,,,,,,,,,,,,
11,Fun and Fancy Free,"Jack Kinney , Bill Roberts , Hamilton Luske , William Morgan ","Homer Brightman, Eldon Dedini, Lance Nolley, Tom Oreb, Harry Reeves, Ted Sears","['Little Bear Bongo', 'by', 'Sinclair Lewis', 'Bongo', 'Jack and the Beanstalk', 'Mickey and the Beanstalk']","['Walt Disney', 'Ben Sharpsteen']","Oliver Wallace, Paul Smith, Eliot Daniel, Charles Wolcott",Walt Disney Productions,RKO Radio Pictures,,73 minutes,United States,English,,$3.165 million ,73.0,3165000.0,,1947-09-27,6.4,66.0,73.0,"Edgar Bergen, Dinah Shore",,"September 27, 1947 ",,Jack Bachom,,,,,,,,,,,,,,,,,,,,,,,,,,,,,,,,,
12,Melody Time,"['Clyde Geronimi', 'Wilfred Jackson', 'Hamilton Luske', 'Jack Kinney']","['Winston Hibler', 'Erdman Penner', 'Harry Reeves', 'Homer Brightman', 'Ken Anderson', 'Ted Sears', 'Joe Rinaldi', 'Bill Cottrell', 'Art Scott', 'Jesse Marsh', 'Bob Moore', 'John Walbridge']",,"['Walt Disney', 'Ben Sharpsteen']","['Eliot Daniel', 'Paul J. Smith', 'Ken Darby']",Walt Disney Productions,RKO Radio Pictures,,75 minutes,United States,English,$1.5 million,$2.56 million ,75.0,2560000.0,1500000.0,1948-05-27,6.1,69.0,75.0,"Roy Rogers, Dennis Day, The Andrews Sisters, Frances Langford, Freddy Martin, Ethel Smith, Buddy Clark, Fred Waring and the Pennsylvanians, Sons of the Pioneers, The Dinning Sisters, Jack Fina, Luana Patten, Bobby Driscoll",Winton Hoch,"May 27, 1948 ",,"['Donald Halliday', 'Thomas Scott']",,Bob Nolan ,,,,,,,,,,,,,,,,,,,,,,,,,,,,,,,
13,So Dear to My Heart,"['Harold D. Schuster', 'Hamilton Luske']",,"['Midnight and Jeremiah', 'by', 'Sterling North']","['Walt Disney', 'Perce Pearce']",Paul Smith,Walt Disney Productions,RKO Radio Pictures,"November 29, 1948",82 minutes,United States,English,$1.5 million,"$3.7 million  + $575,000 ",82.0,3700000.0,1500000.0,1948-11-29,6.7,N/A,N/A,"Burl Ives, Beulah Bondi, Harry Carey, Luana Patten, Bobby Driscoll",Winton C. Hoch,,,Lloyd L. Richardson,,,John Tucker Battle,Maurice RapfTed Sears,,,,,,,,,,,,,,,,,,,,,,,,,,,,,
14,The Adventures of Ichabod and Mr. Toad,"Ben Sharpsteen, Jack Kinney, Clyde Geronimi, James Algar","Erdman Penner, Winston Hibler, Joe Rinaldi, Ted Sears, Homer Brightman, Harry Reeves","['The Wind in the Willows', 'by', 'Kenneth Grahame', 'The Legend of Sleepy Hollow', 'by', 'Washington Irving']",Walt Disney,Oliver Wallace,Walt Disney Productions,RKO Radio Pictures,,68 minutes,United States,English,,$1.625 million ,68.0,1625000.0,,1949-10-05,6.8,74.0,88.0,"Eric Blore, Pat O'Malley, John Ployardt, Colin Campbell, Campbell Grant, Claude Allister, The Rhythmaires",,"October 5, 1949 ",,John O. Young,,"Bing Crosby , Basil Rathbone ",,,,,,,,,,,,,,,,,,,,,,,,,,,,,,,
15,Cinderella,"Wilfred Jackson, Hamilton Luske, Clyde Geronimi","William Peet, Ted Sears, Homer Brightman, Kenneth Anderson, Erdman Penner, Winston Hibler, Harry Reeves, Joe Rinaldi","['Cinderella', 'by', 'Charles Perrault']","Walt Disney, Ben Sharpsteen","Oliver Wallace, Paul Smith",Walt Disney Productions,RKO Radio Pictures,"February 15, 1950",76 minutes,United States,English,$2.2 million,$182 million,76.0,182000000.0,2200000.0,1950-02-15,6.9,67.0,84.0,"Ilene Woods, Eleanor Audley, Verna Felton, Rhoda Williams, James MacDonald, Luis van Rooten",,,,Donald Halliday,,,,,,,,,,,,,,,,,,,,,,,,,,,,,,,,,
16,Treasure Island,Byron Haskin,,"['Treasure Island', 'by', 'Robert Louis Stevenson']","Walt Disney, Perce Pearce",Clifton Parker,RKO-Walt Disney British Productions Limited,RKO Radio Pictures,"June 22, 1950",96 minutes,,English,$1.8 million,$4.1 million ,96.0,4100000.0,1800000.0,1950-06-22,6.9,89.0,N/A,"Bobby Driscoll, Robert Newton, Basil Sydney, Finlay Currie",Freddie Young,,Lawrence Edward Watkin,Alan Jaggs,,,,,"['United States', 'United Kingdom']",,,,,,,,,,,,,,,,,,,,,,,,,,,,
17,Alice in Wonderland,"Ben Sharpsteen, Clyde Geronimi, Wilfred Jackson, Hamilton Luske","Winston Hibler, Ted Sears, Bill Peet, Erdman Penner, Joe Rinaldi, Milt Banta, Bill Cottrell, Dick Kelsey, Joe Grant, Dick Huemer, Del Connell, Tom Oreb, John Walbridge","[""Alice's Adventures in Wonderland"", 'and', 'Through the Looking-Glass', 'by', 'Lewis Carroll']",Walt Disney,Oliver Wallace,Walt Disney Productions,RKO Radio Pictures,"July 26, 1951",75 minutes,United States,English,$3 million,"$2.4 million , $3.5 million ",75.0,2400000.0,3000000.0,1951-07-26,6.4,53.0,50.0,"Ed Wynn, Richard Haydn, Sterling Holloway, Jerry Colonna, Kathryn Beaumont",,,,Lloyd Richardson,,,,,,,,,,,,,,,,,,,,,,,,,,,,,,,,,
18,The Story of Robin Hood and his Merrie Men,Ken Annakin,,,"['Perce Pearce', 'Walt Disney']",Clifton Parker,RKO-Walt Disney British Productions Limited,RKO Radio Pictures Ltd.,13 March 1952,84 minutes,,English,,$2.1 million ,84.0,2100000.0,,1952-03-13,6.5,64.0,N/A,"['Richard Todd', 'Joan Rice', 'Peter Finch']",Guy Green,,Lawrence Edward Watkin,Gordon Pilkington,,,,,"['United States', 'United Kingdom']",,,,,,,,,,,,,,,,,,,,,,,,,,,,
19,Peter Pan,"Hamilton Luske, Clyde Geronimi, Wilfred Jackson","Ted Sears, Erdman Penner, Bill Peet, Winston Hibler, Joe Rinaldi, Milt Banta, Ralph Wright, Bill Cottrell","['Peter and Wendy', 'by', 'J. M. Barrie']",Walt Disney,Oliver Wallace,Walt Disney Productions,RKO Radio Pictures,,77 minutes,United States,English,$4 million,$87.4 million ,77.0,87400000.0,4000000.0,1953-02-05,7.3,76.0,78.0,"Bobby Driscoll, Kathryn Beaumont, Hans Conried, Bill Thompson, Heather Angel, Paul Collins, Tommy Luske, Candy Candido, Tom Conway, Roland Dupreee, Don Barclay",,"February 5, 1953 ",,Donald Halliday,,,,,,,,,,,,,,,,,,,,,,,,,,,,,,,,,
20,The Sword and the Rose,Ken Annakin,,"['When Knighthood Was in Flower', 'by', 'Charles Major', 'James B. Fagan']","['Perce Pearce', 'Walt Disney']",Clifton Parker,RKO-Walt Disney British Productions Limited,RKO Radio Pictures Ltd.,,92 minutes,,English,$2 million,$1 million ,92.0,1000000.0,2000000.0,1953-07-23,6.3,N/A,N/A,"['Glynis Johns', 'James Robertson Justice', 'Richard Todd', 'Michael Gough', 'Jane Barrett', 'Peter Copley', 'Ernest Jay', 'Jean Mercure', 'D. A. Clarke-Smith', 'Gérard Oury', 'Fernand Fabre', 'Gaston Richer', 'Rosalie Crutchley', 'Bryan Coleman']",Geoffrey Unsworth,"July 23, 1953  ",,Gerald Thomas,,,Lawrence Edward Watkin,,"['United Kingdom', 'United States']",,,,,,,,,,,,,,,,,,,,,,,,,,,,
21,The Living Desert,James Algar,,,"['Ben Sharpsteen', 'Walt Disney']",Paul J. Smith,Walt Disney Productions,Buena Vista Distribution,,69 minutes,United States,English,"$300,000",$2.6 million ,69.0,2600000.0,300000.0,1953-11-09,7.4,69.0,N/A,,"['Robert H. Crandall', 'N. Paul Kenworthy']","November 9, 1953 ","['James Algar', 'Winston Hibler']",Norman R. Palmer,,Winston Hibler,,,,,,,,,,,,,,,,,,,,,,,,,,,,,,,
22,Rob Roy: The Highland Rogue,Harold French,,,"['Perce Pearce', 'Walt Disney']",Cedric Thorpe Davie,RKO-Walt Disney British Productions,RKO Radio Pictures,26 October 1953,81 minutes,,English,$1.8 million,"$1,050,000",81.0,1050000.0,1800000.0,1953-10-26,6.3,N/A,N/A,"['Richard Todd', 'Glynis Johns', 'James Robertson Justice', 'Michael Gough', 'Finlay Currie', 'Geoffrey Keen']",Guy Green,,Lawrence Edward Watkin,Geoffrey Foot,,,,,"['United Kingdom', 'United States']",,,,,,,,,,,,,,,,,,,,,,,,,,,,
23,The Vanishing Prairie,James Algar,,,"['Ben Sharpsteen', 'Walt Disney']",Paul J. Smith,Walt Disney Productions,Buena Vista Distribution,,"['60 minutes ', '71 minutes ']",United States,English,,$1.75 million ,60.0,1750000.0,,1954-08-17,7.2,N/A,N/A,,N. Paul Kenworthy,"August 17, 1954 ","['James Algar', 'Winston Hibler']",Lloyd L. Richardson,,Winston Hibler,,,,,,,,,,,,,,,,,,,,,,,,,,,,,,,
24,"20,000 Leagues Under the Sea",Richard Fleischer,,"['Twenty Thousand Leagues Under the Seas', 'by', 'Jules Verne']",Walt Disney,Paul Smith,Walt Disney Productions,Buena Vista Distribution,,127 minutes,United States,English,$5 million,$28.2 million,127.0,28200000.0,5000000.0,1954-12-23,7.2,83.0,91.0,"Kirk Douglas, James Mason, Paul Lukas, Peter Lorre",Franz Planer,"December 23, 1954 ",,Elmo Williams,,,Earl Felton,,,,,,,,,,,,,,,,,,,,,,,,,,,,,,
25,Davy Crockett: King of the Wild Frontier,Norman Foster,,,Bill Walsh,Thomas W. Blackburn George BrunsEdward H. Plumb ,Walt Disney Productions,"Buena Vista Film Distribution Co., Inc.",,93 minutes,United States,English,,"$2,150,000 ",93.0,2150000.0,,1955-05-25,6.9,N/A,100.0,"['Fess Parker', 'Buddy Ebsen']",Charles P. Boyle,"May 25, 1955 ",Tom Blackburn,Chester W. Schaeffer,,,,,,,,,,,,,,,,,,,,,,,,,,,,,,,,,
26,Lady and the Tramp,"Hamilton Luske, Clyde Geronimi, Wilfred Jackson","Erdman Penner, Joe Rinaldi, Ralph Wright, Don DaGradi","['""Happy Dan, the Cynical Dog""', 'by', 'Ward Greene']",Walt Disney,Oliver Wallace,Walt Disney Productions,Buena Vista Film Distribution,,76 minutes,United States,English,$4 million,$187 million,76.0,187000000.0,4000000.0,1955-06-22,7.3,78.0,93.0,"Peggy Lee, Barbara Luddy, Larry Roberts, Bill Thompson, Bill Baucom, Stan Freberg, Verna Felton, Alan Reed, George Givot, Dallas McKennon, Lee Millar, The Mellomen",,"June 22, 1955 ",,Don Halliday,,,,,,,,,,,,,,,,,,,,,,,,,,,,,,,,,
27,The African Lion,James Algar,,,"['Walt Disney', 'Ben Sharpsteen']",Paul J. Smith,Walt Disney Productions,Buena Vista Distribution,,75 minutes,United States,English,,$2.1 million ,75.0,2100000.0,,1955-09-14,7.2,N/A,N/A,,"['Alfred Milotte', 'Elma Milotte']","September 14, 1955 ","['James Algar', 'Winston Hibler']",Norman R. Palmer,,Winston Hibler,,,,,,,,,,,,,,,,,,,,,,,,,,,,,,,
28,The Littlest Outlaw,Roberto Gavaldón,,,,William Lava,Walt Disney Productions,Buena Vista Distribution,,73 minutes,,,,$1.6 million ,73.0,1600000.0,,1955-12-22,6.1,N/A,85.0,"['Pedro Armendáriz', 'Joseph Calleia', 'Andrés Velázquez']",Alex Phillips,"December 22, 1955 ",,Carlos Savage,"['English', 'Spanish']",,,,"['United States', 'Mexico']",,,,,,,,,,,,,,,,,,,,,,,,,,,,
29,The Great Locomotive Chase,Francis D. Lyon,,,"['Lawrence Edward Watkin', 'Walt Disney']",Paul J. Smith,Walt Disney Productions,Buena Vista Distribution,,85 minutes,United States,English,,$1.7 million ,85.0,1700000.0,,1956-06-08,6.8,N/A,N/A,"['Fess Parker', 'Jeffrey Hunter', 'John Lupton', 'Jeff York', 'Slim Pickens']",Charles Boyle,"June 8, 1956 ",Lawrence Edward Watkin,Ellsworth Hoagland,,,,,,,,,,,,,,,,,,,,,,,,,,,,,,,,,
30,Davy Crockett and the River Pirates,Norman Foster,,,Bill Walsh,Thomas W. Blackburn George BrunsEdward H. Plumb ,Walt Disney Productions,"Buena Vista Film Distribution Co., Inc.",,81 minutes,United States,English,,,81.0,,,1956-07-18,6.6,N/A,N/A,Fess ParkerBuddy EbsenJeff York,Bert Glennon,"July 18, 1956 ","['Tom Blackburn', 'Norman Foster']",Stanley Johnson,,,,,,Technicolor,,,,,,,,,,,,,,,,,,,,,,,,,,,
31,Secrets of Life,James Algar,,,"['Ben Sharpsteen', 'Walt Disney']",Paul Smith,Walt Disney Productions,Buena Vista Distribution,,70 minutes,United States,English,,,70.0,,,1956-09-04,7.3,N/A,N/A,,"['William A. Anderson', 'Arthur Carter', 'Jack Couffer', 'Robert H. Crandall', 'Murl Deusing', 'Fran William Hall', 'Claude Jendrusch', 'Stuart V. Jewell', 'George MacGinitie', 'Nettie MacGinitie', 'Tilden W. Roberts', 'Donald L. Sykes', 'Roman Vishniac']","September 4, 1956 ",James Algar,Anthony Gerard,,Winston Hibler,,,,,,,,,,,,,,,,,,,,,,,,,,,,,,,
32,Westward Ho the Wagons!,William Beaudine,,Children of the Covered Wagon by Mary Jane Carr,Bill Walsh,George Bruns,Walt Disney Productions,Buena Vista Distribution,,90 minutes,United States,English,,$2.75 million ,90.0,2750000.0,,1956-12-20,5.7,N/A,N/A,"['Fess Parker', 'Kathleen Crowley', 'Jeff York', 'Sebastian Cabot', 'George Reeves', 'David Stollery']","Charles P. Boyle, A.S.C.","December 20, 1956 ",,"Cotton Warburton, A.C.E.",,,Tom Blackburn,,,,,,,,,,,,,,,,,,,,,,,,,,,,,,
33,Johnny Tremain,Robert Stevenson,,,Walt Disney,"['George Bruns', 'Tom Blackburn ', 'Song ""Liberty Tree"" by George Bruns and Tom Blackburn']",Walt Disney Productions,Buena Vista Distribution,,80 minutes,United States,English,"$700,000",,80.0,,700000.0,1957-06-19,6.4,N/A,N/A,"['Hal Stalmaster', 'Luana Patten', 'Jeff York', 'Sebastian Cabot']",Charles P. Boyle,"June 19, 1957 ","['Esther Forbes', 'Tom Blackburn']",Stanley E. Johnson,,,,,,,,,,,,,,,,,,,,,,,,,,,,,,,,,
34,Perri,"['N. Paul Kenworthy', 'Ralph Wright']",,,Winston Hibler,"['Score', 'Paul J. Smith', 'Songs', 'George Bruns', 'Winston Hibler', 'Ralph Wright', 'Paul J. Smith', 'Hazel ""Gil"" George', 'Song arrangements', 'Carl Brandt', 'Orchestrations', 'Carl Brandt', 'Franklyn Marks']",Walt Disney Productions,Buena Vista Distribution,,75 minutes,United States,English,,$1.75 million ,75.0,1750000.0,,1957-08-28,6.7,N/A,N/A,,,"August 28, 1957 ","['Ralph Wright', 'Winston Hibler', 'Felix Salten', 'Book']",Jack Atwood,,Winston Hibler,,,,,,,,,,,,,,,,,,,,,,,,,,,,,,,
35,Old Yeller,Robert Stevenson,,"['Old Yeller', 'by', 'Fred Gipson']",Walt Disney,"Oliver Wallace, Will Schaefer",Walt Disney Productions,Buena Vista Distribution,,84 minutes,United States,English,,$6.25 million ,84.0,6250000.0,,1957-12-25,7.2,84.0,100.0,"Dorothy McGuire, Fess Parker, Jeff York, Tommy Kirk, Kevin Corcoran, Beverly Washburn, Chuck Connors",Charles P. Boyle,"December 25, 1957 ",,Stanley E. Johnson,,,"Fred Gipson, William Tunberg",,,Technicolor,,,,,,,,,,,,,,,,,,,,,,,,,,,
36,The Light in the Forest,Herschel Daugherty,,novel by Conrad Richter,Walt Disney,"['Paul J. Smith', 'Franklyn Marks ']",Walt Disney Productions,Buena Vista Distribution,,83 minutes,United States,English,,$2 million,83.0,2000000.0,,1958-07-08,6.4,N/A,N/A,"['Fess Parker', 'Wendell Corey', 'Joanne Dru', 'James MacArthur', 'Jessica Tandy']",Ellsworth Fredericks,"July 8, 1958 ",Lawrence Edward Watkin,,,,,,,,,,,,,,,,,,,,,,,,,,,,,,,,,,
37,White Wilderness,James Algar,,,"Ben Sharpsteen, Walt Disney",Oliver Wallace,Walt Disney Productions,Buena Vista Distribution,,72 minutes,,English,,$1.8 million ,72.0,1800000.0,,1958-08-12,5.4,N/A,N/A,,,"August 12, 1958 ",James Algar,Norman R. Palmer,,Winston Hibler,,,"['United States', 'Canada']",,,,,,,,,,,,,,,,,,,,,,,,,,,,
38,Tonka,Lewis R. Foster,,"[""Comanche: Story of America's Most Heroic Horse"", 'by David Appel']",James C. Pratt,Oliver Wallace,Walt Disney Productions,Buena Vista Distribution,,97 minutes,United States,English,,$2.5 million ,97.0,2500000.0,,1958-12-25,6.2,N/A,N/A,"['Sal Mineo', 'Philip Carey', 'Jerome Courtland', 'Rafael Campos']",Loyal Griggs,"December 25, 1958 ","['David Appel', 'Lewis R. Foster', 'Lillie Hayward']",Ellsworth Hoagland,,,,,,Technicolor,,,,,,,,,,,,,,,,,,,,,,,,,,,
39,Sleeping Beauty,"Clyde Geronimi, Wolfgang Reitherman, Eric Larson, Les Clark","Erdman Penner, Joe Rinaldi, Winston Hibler, Bill Peet, Ted Sears, Ralph Wright, Milt Banta","['Sleeping Beauty', 'by', 'Charles Perrault']",Walt Disney,George Bruns,Walt Disney Productions,Buena Vista Distribution,,75 minutes,United States,English,$6 million,$51.6 million ,75.0,51600000.0,6000000.0,1959-01-29,7.2,85.0,90.0,"Mary Costa, Bill Shirley, Eleanor Audley, Verna Felton, Barbara Luddy, Barbara Jo Allen, Taylor Holmes, Bill Thompson",,"January 29, 1959 ",,"Roy M. Brewer Jr., Donald Halliday",,,,,,,,,,,,,,,,,,,,,,,,,,,,,,,,,
40,The Shaggy Dog,Charles Barton,,"['The Hound of Florence', 'by', 'Felix Salten']","['Walt Disney', 'Bill Walsh']",Paul J. Smith,Walt Disney Productions,Buena Vista Distribution,,104 minutes,United States,English,"under $1 million or $1,250,000",$12.3 million ,104.0,12300000.0,1000000.0,1959-03-19,4.4,43.0,26.0,"Fred MacMurray, Jean Hagen, Tommy Kirk, Annette Funicello, Cecil Kellaway, Alexander Scourby, James Westerfield, Jacques Aubuchon",Edward Colman,"March 19, 1959 ",,James Ballas,,Paul Frees,"['Lillie Hayward', 'Bill Walsh']",,,,,,,,,,,,,,,,,,,,,,,,,,,,,,
41,Darby O'Gill and the Little People,Robert Stevenson,,"[""Darby O'Gill"", 'by', 'H. T. Kavanagh']","['Bill Anderson', 'Walt Disney']",Oliver Wallace,Walt Disney Productions,Buena Vista Distribution,"June 24, 1959",93 minutes,United States,English,,Original release $2.6 million  1969 re-release $2.3 million  ,93.0,2600000.0,,1959-06-24,7.1,80.0,100.0,"['Albert Sharpe', 'Janet Munro', 'Sean Connery', ""Jimmy O'Dea"", 'Kieron Moore', 'Estelle Winwood', 'Walter Fitzgerald']",Winton Hoch,,Lawrence Edward Watkin,Stanley Johnson,,,,,,,,,,,,,,,,,,,,,,,,,,,,,,,,,
42,Third Man on the Mountain,Ken Annakin,,"['Banner in the Sky', '1954 novel', 'by', 'James Ramsey Ullman']","['Bill Anderson', 'Walt Disney']",William Alwyn,Walt Disney Productions,Buena Vista Distribution,,105 minutes,United States,English,$2 million,"$1,700,000 ",105.0,1700000.0,2000000.0,1959-11-10,7.0,N/A,N/A,"['Michael Rennie', 'James MacArthur', 'Janet Munro']",Harry Waxman,"November 10, 1959 ",Eleanore Griffin,Peter Boita,,,,,,,,,,,,,,,,,,,,,,,,,,,,,,,,,
43,Toby Tyler or 10 Weeks with a Circus,Charles Barton,,"['Toby Tyler; or, Ten Weeks with a Circus', 'by', 'James Otis Kaler']",Bill Walsh,Buddy Baker,Walt Disney Productions,Buena Vista Distribution,,95 minutes,United States,English,,"$3,100,000 ",95.0,3100000.0,,1960-01-21,N/A,N/A,N/A,"['Kevin Corcoran', 'Henry Calvin', 'Gene Sheldon', 'Richard Eastham']",,"January 21, 1960  ","['Lillie Hayward', 'Bill Walsh']",,,,,,,,,,,,,,,,,,,,,,,,,,,,,,,,,,
44,Kidnapped,Robert Stevenson,,"['Kidnapped', 'by', 'Robert Louis Stevenson']",Walt Disney,Cedric Thorpe Davie,Walt Disney Productions,Buena Vista Distribution,,97 minutes,United States,,,,97.0,,,1960-02-24,6.4,49.0,44.0,"['Peter Finch', 'James MacArthur', 'Bernard Lee']",Paul Beeson,"February 24, 1960 ",Robert Stevenson,Gordon Stone,"English, Scots",,,,,,,,,,,,,,,,,,,,,,,,,,,,,,,,
45,Pollyanna,David Swift,,"['Pollyanna', 'by', 'Eleanor Porter']",Walt Disney,Paul Smith,Walt Disney Productions,Buena Vista Distribution,,134 minutes,United States,English,$2.5 million,$3.75 million ,134.0,3750000.0,2500000.0,1960-05-19,7.4,66.0,86.0,"['Jane Wyman', 'Richard Egan', 'Karl Malden', 'Nancy Olson', 'Adolphe Menjou', 'Donald Crisp', 'Agnes Moorehead', 'Kevin Corcoran', 'Hayley Mills']",Russell Harlan,"May 19, 1960 ",,Frank Gross,,,David Swift,,,,,,,,,,,,,,,,,,,,,,,,,,,,,,
