,title,Directed by,Story by,Based on,Produced by,Music by,Production company,Distributed by,Release dates,Running time,Country,Language,Budget,Box office,Running time(int),Box office(float),Budget(float),Release date (Datetime),IMDb rating,Meta Score,Rotten Tomatoes (%),Starring,Cinematography,Release date,Written by,Edited by,Languages,Narrated by,Screenplay by,Adaptation by,Countries,Color process,Genre,Created by,Country of origin,No.  of seasons,No.  of episodes,Executive producers,Network,Release,Production companies,Original language,Producer,Developed by,Voices of,Theme music composer,Opening theme,Ending theme,Composer,Producers,Editor,Kanji,Transcriptions,Revised Hepburn,Traditional Chinese,Simplified Chinese,Literal meaning,Original title,Layouts by
376,Old Dogs,Walt Becker,,,"['Andrew Panay', 'Robert L. Levy', 'Peter Abrams']",John Debney,,"['Walt Disney Studios', 'Motion Pictures']",,88 minutes,United States,English,$35 million,$96.8 million,88.0,96800000.0,35000000.0,2009-11-25,5.3,19.0,5.0,"['John Travolta', 'Robin Williams', 'Kelly Preston', 'Seth Green', 'Ella Bleu Travolta', 'Lori Loughlin', 'Matt Dillon']",Jeffrey L. Kimball,"November 25, 2009 ","['David Diamond', 'David Weissman']","['Tom Lewis', 'Ryan Folsey']",,,,,,,,,,,,,,,"['Walt Disney Pictures', 'Tapestry Films']",,,,,,,,,,,,,,,,,,
377,The Princess and the Frog,"John Musker, Ron Clements","Ron Clements, John Musker, Greg Erb, Jason Oremland","['The Frog Princess', 'by', 'E. D. Baker', 'The Frog Prince', 'by', 'Brothers Grimm']",Peter Del Vecho,Randy Newman,Walt Disney Animation Studios,Walt Disney Studios Motion Pictures,"November 25, 2009",97 minutes,United States,English,$105 million,$271 million,97.0,271000000.0,105000000.0,2009-11-25,7.2,73.0,85.0,"Anika Noni Rose, Bruno Campos, Keith David, Michael-Leon Wooley, Jim Cummings, Jennifer Cody, Peter Bartlett, Jenifer Lewis, Oprah Winfrey, Terrence Howard, John Goodman",,,,Jeff Draheim,,,"Ron Clements, John Musker, Rob Edwards",,,,,,,,,,,,,,,,,,,,,,,,,,,,,,
378,Alice in Wonderland,Tim Burton,,"[""Alice's Adventures in Wonderland"", 'and', 'Through the Looking-Glass', 'by', 'Lewis Carroll']","Richard D. Zanuck, Joe Roth, Suzanne Todd, Jennifer Todd",Danny Elfman,,Walt Disney Studios Motion Pictures,"February 25, 2010",108 minutes,United States,English,$150–$200 million,$1.025 billion,108.0,1025000000.0,150000000.0,2010-02-25,6.4,53.0,50.0,"Johnny Depp, Anne Hathaway, Helena Bonham Carter, Crispin Glover, Mia Wasikowska, Alan Rickman, Stephen Fry, Michael Sheen, Timothy Spall",Dariusz Wolski,,,Chris Lebenzon,,,Linda Woolverton,,,,,,,,,,,,"Walt Disney Pictures, Roth Films, The Zanuck Company, Team Todd",,,,,,,,,,,,,,,,,,
379,Waking Sleeping Beauty,Don Hahn,,,"['Don Hahn', 'Peter Schneider']",Chris P. Bacon,Stone Circle Pictures,"['Walt Disney Studios', 'Motion Pictures']","September 6, 2009",85 minutes,United States,English,,"$84,918",85.0,84918.0,,2009-09-06,7.5,70.0,71.0,"['Roy E. Disney', 'Michael Eisner', 'Jeffrey Katzenberg', 'Randy Cartwright', 'Howard Ashman']",,,Patrick Pacheco,"['Ellen Keneshea', 'Vartan Nazarian', 'John Damien Ryan']",,Don Hahn,,,,,,,,,,,,,,,,,,,,,,,,,,,,,,,
380,Oceans,"['Jacques Perrin', 'Jacques Cluzaud']",,,"['Jacques Perrin', 'Romain Legrand', 'Nicolas Mauvernay', 'Jake Eberts']",Bruno Coulais,,Pathé Distribution,"October 17, 2009","['104 minutes ', '84 minutes ']",France,French,"€57.1 million, {US$80 million)",$82.7 million,104.0,82700000.0,57100000.0,2009-10-17,7.7,75.0,81.0,,David Reichert,,"['Christophe Cheysson', 'Jacques Cluzaud', 'Laurent Debas', 'Stéphane Durand', 'Laurent Gaudé', 'Jacques Perrin', 'François Sarano']","['Catherine Mauchain', 'Vincent Schmidt']",,"['Jacques Perrin', 'Pierce Brosnan']",,,,,,,,,,,,,"['Pathé', 'Participant Media', 'Galatée Films', 'France 2 Cinéma', 'France 3 Cinéma', 'Canal+', 'TPS Star', 'Alfred P. Sloan Foundation', 'Census of Marine Life']",,,,,,,,,,,,,,,,,,
381,Prince of Persia:The Sands of Time,Mike Newell,Jordan Mechner,"['Prince of Persia', 'by Jordan Mechner']",Jerry Bruckheimer,Harry Gregson-Williams,,"['Walt Disney Studios', 'Motion Pictures']","May 9, 2010",116 minutes,United States,English,$150–200 million,$336.4 million,116.0,336400000.0,150000000.0,2010-05-09,6.6,50.0,36.0,"Jake Gyllenhaal, Ben Kingsley, Gemma Arterton, Alfred Molina",John Seale,,,"Michael Kahn, Martin Walsh, Mick Audsley",,,"Boaz Yakin, Doug Miro, Carlo Bernard",,,,,,,,,,,,"Walt Disney Pictures, Jerry Bruckheimer Films",,,,,,,,,,,,,,,,,,
382,Toy Story 3,Lee Unkrich,"John Lasseter, Andrew Stanton, Lee Unkrich",,Darla K. Anderson,Randy Newman,Pixar Animation Studios,"['Walt Disney Studios', 'Motion Pictures']","June 12, 2010",103 minutes,United States,English,$200 million,$1.067 billion,103.0,1067000000.0,200000000.0,2010-06-12,8.3,92.0,98.0,"Tom Hanks, Tim Allen, Joan Cusack, Don Rickles, Wallace Shawn, John Ratzenberger, Estelle Harris, Ned Beatty, Michael Keaton, Jodi Benson, John Morris","Jeremy Lasky, Kim White",,,Ken Schretzmann,,,Michael Arndt,,,,,,,,,,,,,,,,,,,,,,,,,,,,,,
383,The Sorcerer's Apprentice,Jon Turteltaub,"Matt Lopez, Lawrence Konner, Mark Rosenthal","[""The Sorcerer's Apprentice"", 'by', 'Johann Wolfgang von Goethe']",Jerry Bruckheimer,Trevor Rabin,,"['Walt Disney Studios', 'Motion Pictures']","July 8, 2010",109 minutes,United States,English,$150 million,$215.3 million,109.0,215300000.0,150000000.0,2010-07-08,6.1,46.0,40.0,"Nicolas Cage, Jay Baruchel, Alfred Molina, Teresa Palmer, Monica Bellucci",Bojan Bazelli,,,William Goldenberg,,,"Doug Miro, Carlo Bernard, Matt Lopez",,,,,,,,,,,,"Walt Disney Pictures, Jerry Bruckheimer Films, Saturn Films, Broken Road Productions",,,,,,,,,,,,,,,,,,
384,Tales from Earthsea,Gorō Miyazaki,,"['Earthsea', 'by', 'Ursula K. Le Guin', ""Shuna's Journey"", 'by', 'Hayao Miyazaki']",Toshio Suzuki,Tamiya Terashima,Studio Ghibli,Toho,,115 minutes,Japan,Japanese,$22 million,$75.5 million,115.0,75500000.0,22000000.0,2006-07-29,6.3,47.0,N/A,"Bunta Sugawara, Junichi Okada, Aoi Teshima, Yūko Tanaka",Atsushi Okui,"July 29, 2006 ",,Takeshi Seyama,,,"Gorō Miyazaki, Keiko Niwa",,,,,,,,,,,,,,,,,,,,,,,ゲド戦記,TranscriptionsRevised HepburnGedo Senki,Gedo Senki,,,Ged's War Chronicles,,
385,The Crimson Wing: Mystery of the Flamingos,"['Matthew Aeberhard', 'Leander Ward']",,,"['Matthew Aeberhard', 'Leander Ward', 'Paul Webster', 'Stephen Garrett ']",The Cinematic Orchestra,,Walt Disney Studios Motion Pictures,26 October 2008,74 minutes,,English,,,74.0,,,2008-10-26,7.3,N/A,75.0,,,,Melanie Finn,,,"['Mariella Frostrup', 'UK', 'US', 'Zabou Breitman', 'France']",,,"['United Kingdom', 'United States']",,,,,,,,,,"['Disneynature', 'Natural Light Films', 'Kudos Pictures']",,,,,,,,,,,,,,,,,,
386,Tinker Bell and the Great Fairy Rescue,Bradley Raymond,"['Bradley Raymond', 'Jeffrey M. Howard']","['Tinker Bell', 'by', 'J. M. Barrie']","['Helen Kalafatic', 'Margot Pipkin']",Joel McNeely,,"['Walt Disney Studios', 'Home Entertainment', 'Walt Disney Studios', 'Motion Pictures']","August 13, 2010",79 minutes,United States,English,$30—$35 million,$10.87 million,79.0,10870000.0,30000000.0,2010-08-13,6.9,N/A,70.0,Mae WhitmanPamela AdlonLauren MoteMichael SheenLucy LiuRaven-SymonéKristin ChenowethAngela Bartys,,,,,,Cara Dillon,Joe AnsolabeherePaul GermainBob HilgenbergRob Muir,,,,,,,,,,,,"['Walt Disney Pictures', 'Disneytoon Studios']",,,,,,,,,,,,,,,,,,
387,Secretariat,Randall Wallace,,,"['Mark Ciardi', 'Gordon Gray']",Nick Glennie-Smith,,"['Walt Disney Studios', 'Motion Pictures']","September 30, 2010",123 minutes,United States,English,$35 million,$60.3 million,123.0,60300000.0,35000000.0,2010-09-30,7.2,61.0,64.0,"Diane Lane, John Malkovich, Dylan Walsh, James Cromwell, Kevin Connolly, Scott Glenn",Dean Semler,,"['Mike Rich', 'Sheldon Turner']",John Wright,,,,,,,,,,,,,,,Walt Disney PicturesMayhem Pictures,,,,,,,,,,,,,,,,,,
388,Do Dooni Chaar,Habib Faisal,Habib Faisal,,Arindam Chaudhuri,"['Meet Bros Anjjan', 'Ankit Tiwari']",,Walt Disney Studios Motion Pictures,,108 minutes,India,Hindi,,,108.0,,,2010-10-08,7.5,N/A,N/A,"['Rishi Kapoor', 'Neetu Singh']",Anshuman Mahaley,8 October 2010 ,,Aarti Bajaj,,,"['Habib Faisal', 'Rahil Qazi']",,,,,,,,,,,,"Walt Disney Pictures, Planman Motion Pictures, Walt Disney Pictures India",,,,,,,,,,,,,,,,,,
389,Tangled,"Nathan Greno, Byron Howard",,"['Rapunzel', 'by the', 'Brothers Grimm']",Roy Conli,Alan Menken,,"['Walt Disney Studios', 'Motion Pictures']","November 14, 2010",100 minutes,United States,English,$260 million,$592.5 million,100.0,592500000.0,260000000.0,2010-11-14,7.7,71.0,89.0,"Mandy Moore, Zachary Levi, Donna Murphy",,,,Tim Mertens,,,Dan Fogelman,,,,,,,,,,,,"Walt Disney Animation Studios, Walt Disney Pictures",,,,,,,,,,,,,,,,,,
390,Tron: Legacy,Joseph Kosinski,"Edward Kitsis, Adam Horowitz, Brian Klugman, Lee Sternthal","['Characters', 'by', 'Steven Lisberger', 'Bonnie MacBird']","Sean Bailey, Jeffrey Silver, Steven Lisberger",Daft Punk,,Walt Disney Studios Motion Pictures,"November 30, 2010",125 minutes,United States,English,$170 million,$400.1 million,125.0,400100000.0,170000000.0,2010-11-30,6.8,49.0,51.0,"Garrett Hedlund, Jeff Bridges, Olivia Wilde, Bruce Boxleitner, James Frain, Beau Garrett, Michael Sheen",Claudio Miranda,,,James Haygood,,,"Edward Kitsis, Adam Horowitz",,,,,,,,,,,,"Walt Disney Pictures, Sean Bailey Productions",,,,,,,,,,,,,,,,,,
391,Once Upon a Warrior,Prakash Kovelamudi,,,"['Prakash Kovelamudi', 'Prasad Devineni']","['Songs:', 'Salim–Sulaiman', 'Mickey J. Meyer', 'Koti', 'M. M. Keeravani', 'Background Score:', 'Salim–Sulaiman']",,UTV Motion Pictures,,,India,Telugu,₹26 crore,,,,3120000.0,2011-01-14,N/A,N/A,N/A,"['Siddharth', 'Shruti Haasan', 'Lakshmi Manchu', 'Baby Harshitha']",Soundarrajan,14 January 2011  ,Prakash Kovelamudi,Shravan Katikaneni,,,,,,,,,,,,,,,"['Walt Disney Pictures', 'A Bellyful of Dreams Entertainment']",,,,,,,,,,,,,,,,,Anaganaga O Dheerudu,
392,Beverly Hills Chihuahua 2,Alex Zamm,,"['Characters', 'by', 'Jeff Bushell']","['David Hoberman', 'Brad Krevoy']",Chris Hajian,,"['Walt Disney Studios', 'Home Entertainment']",,84 minutes,United States,English,,$29.6 million ,84.0,29600000.0,,2011-02-01,4.2,N/A,N/A,"['George Lopez', 'Odette Yustman', 'Zachary Gordon', 'Emily Osment', 'Bridgit Mendler', 'Tom Kenny']",Robert Brinkmann,"February 1, 2011 ","['Dannah Feinglass', 'Danielle Schneider']","['Marshall Harvey', 'Heath Ryan']",,,,,,,,,,,,,,,"['Walt Disney Pictures', 'MPCA Productions']",,,,,,,,,,,,,,,,,,
393,Lilly the Witch:The Journey to Mandolan,Harald Sicheritz,,,,Ian Honeyman,,Walt Disney Studios Motion Pictures,,90 minutes,Germany,German,,,90.0,,,2011-02-17,4.8,N/A,N/A,"['Alina Freund', 'Pilar Bardem', 'Pegah Ferydoni', 'Anja Kling', 'Tanay Chheda', 'Michael Mendl', 'Lars Rudolph', 'Ercan Durmaz', 'Isak Férriz', 'Jürgen Tarrach', 'Alexander Yassin', 'Michael Mittermeier', 'Cosma Shiva Hagen']",Thomas Kienast,17 February 2011  ,"['Bettine von Borries', 'Achim von Borries']",,,,,,,,,,,,,,,,"['Walt Disney Pictures', 'Buena Vista International Germany']",,,,,,,,,,,,,,,,,,
394,Mars Needs Moms,Simon Wells,,"['Mars Needs Moms!', 'by', 'Berkeley Breathed']",Robert ZemeckisJack RapkeSteve StarkeySteven Boyd,John Powell,,"['Walt Disney Studios', 'Motion Pictures']","March 6, 2011",88 minutes,United States,English,$150 million,$39.2 million,88.0,39200000.0,150000000.0,2011-03-06,5.4,49.0,37.0,"Seth Green, Dan Fogler, Elisabeth Harnois, Mindy Sterling, Joan Cusack",Robert Presley,,,Wayne Wahrman,,,"Simon Wells, Wendy Wells",,,,,,,,,,,,"['Walt Disney Pictures', 'ImageMovers Digital']",,,,,,,,,,,,,,,,,,
395,Zokkomon,Satyajit Bhatkal,,,,"['Songs:', 'Shankar–Ehsaan–Loy', 'Background Score:', 'Hitesh Sonik']",,UTV Motion Pictures,,109 minutes,India,Hindi,,,109.0,,,2011-04-22,4.1,N/A,N/A,Darsheel SafaryManjari FadnisAnupam Kher,Keshav Prakash,22 April 2011 ,,Suresh Pai,,,Satyajit BhatkalLancy FernandesSvati Chakravarty Bhatkal,,,,,,,,,,,,"Disney World Cinema, Walt Disney Pictures India",,,,,,,,,,,,,,,,,,
396,African Cats,"['Keith Scholey', 'Alastair Fothergill']",,,"['Alix Tidmarsh', 'Keith Scholey']",Nicholas Hooper,,Walt Disney Studios Motion Pictures,"April 22, 2011",89 minutes,,,$5 million,$30.9 million,89.0,30900000.0,5000000.0,2011-04-22,7.5,61.0,74.0,,,,,,"['English', 'French']","['Samuel L. Jackson', 'Patrick Stewart']",,,"['United States', 'France', 'United Kingdom']",,,,,,,,,,"Disneynature, Fothergill / Scholey Productions, Silverback Films",,,,,,,,,,,,,,,,,,
397,Prom,Joe Nussbaum,,,"['Ted Griffin', 'Justin Springer']",Deborah Lurie,Walt Disney Pictures,"['Walt Disney Studios', 'Motion Pictures']",,104 minutes,United States,English,$8 million,$10.7 million,104.0,10700000.0,8000000.0,2011-04-29,5.4,50.0,35.0,"['Aimee Teegarden', 'Thomas McDonell', 'Cameron Monaghan', 'Yin Chang', 'Nicholas Braun', 'Dean Norris', 'Danielle Campbell', 'Nolan Sotillo', 'Kylie Bunbury', 'Christine Elise', 'Raini Rodriguez']",Byron Shah,"April 29, 2011 ",Katie Wech,Jeffrey M. Werner,,,,,,,,,,,,,,,,,,,,,,,,,,,,,,,,,
398,Pirates of the Caribbean:On Stranger Tides,Rob Marshall,,"['Characters', 'by', 'Ted Elliott', 'Terry Rossio', 'Stuart Beattie', 'Jay Wolpert', 'Walt Disney', ""'s"", 'Pirates of the Caribbean', 'On Stranger Tides', 'by', 'Tim Powers']",Jerry Bruckheimer,"Hans Zimmer, Eric Whitacre",,"['Walt Disney Studios', 'Motion Pictures']","May 7, 2011",137 minutes,United States,English,"$410.6 million , $378.5 million ",$1.046 billion,137.0,1046000000.0,410600000.0,2011-05-07,6.6,45.0,33.0,"Johnny Depp, Penélope Cruz, Ian McShane, Kevin R. McNally, Geoffrey Rush",Dariusz Wolski,,"Ted Elliott, Terry Rossio","David Brenner, Wyatt Smith",,,,,,,,,,,,,,,"Walt Disney Pictures, Jerry Bruckheimer Films",,,,,,,,,,,,,,,,,,
399,Cars 2,John Lasseter,"John Lasseter, Brad Lewis, Dan Fogelman",,Denise Ream,Michael Giacchino,Pixar Animation Studios,"['Walt Disney Studios', 'Motion Pictures']","June 18, 2011",106 minutes,United States,English,$200 million,$559.8 million,106.0,559800000.0,200000000.0,2011-06-18,6.2,57.0,39.0,"Larry the Cable Guy, Owen Wilson, Michael Caine, Emily Mortimer, John Turturro, Eddie Izzard","Jeremy Lasky, Sharon Calahan",,,Stephen Schaffer,,,Ben Queen,,,,,,,,,,,,,,,,,,,,,,,,,,,,,,
400,Winnie the Pooh,"Stephen Anderson, Don Hall","Stephen Anderson, Clio Chiang, Don Dougherty, Don Hall, Kendelle Hoyer, Brian Kesinger, Nicole Mitchell, Jeremy Spears","['Winnie-the-Pooh', 'by', 'A. A. Milne', 'E. H. Shepard']","Peter Del Vecho, Clark Spencer",Henry Jackman,Walt Disney Animation Studios,"['Walt Disney Studios', 'Motion Pictures']","April 6, 2011",63 minutes,United States,English,$30 million,$50.1 million,63.0,50100000.0,30000000.0,2011-04-06,7.1,74.0,90.0,"Jim Cummings, Jack Boulter, Travis Oates, Bud Luckey, Tom Kenny, Craig Ferguson, Kristen Anderson-Lopez, Wyatt Dean Hall, Huell Howser",['Julio Macat'],,,Lisa Linder Silver,,,,,,,,,,,,,,,,,,,,,,,,,,,,,,,,,
401,Spooky Buddies,Robert Vince,,"['Characters', 'by Paul Tamasy', 'Aaron Mendelsohn', 'Kevin DiCicco', 'Robert Vince', 'Anna McRoberts']","['Anna McRoberts', 'Robert Vince']",Brahm Wenger,Key Pix Productions,"['Walt Disney Studios', 'Home Entertainment']",,88 minutes,,English,,,88.0,,,2011-09-20,4.6,N/A,N/A,"['Harland Williams', 'Sierra McCormick', 'Elisa Donovan', 'Jennifer Elise Cox', 'Tucker Albrizzi', 'Dylan Sprayberry', 'Rance Howard', 'Pat Finn']",Mike Southon,"September 20, 2011 ","['Anna McRoberts', 'Robert Vince']",Kelly Herron,,,,,"['United States', 'Canada']",,,,,,,,,,,,,,,,,,,,,,,,,,,,
402,The Muppets,James Bobin,,Disney's Muppet characters and properties,"David Hoberman, Todd Lieberman",Christophe Beck,,Walt Disney Studios Motion Pictures,"November 4, 2011",103 minutes,United States,English,$45 million,$165.2 million,103.0,165200000.0,45000000.0,2011-11-04,7.1,75.0,95.0,"Jason Segel, Amy Adams, Chris Cooper, Rashida Jones",Don Burgess,,"Jason Segel, Nicholas Stoller",James Thomas,,,,,,,,,,,,,,,"['Walt Disney Pictures', 'Mandeville Films']",,,,,,,,,,,,,,,,,,
403,Treasure Buddies,Robert Vince,,"['Characters', 'by Paul Tamasy', 'Aaron Mendelsohn', 'Kevin DiCicco', 'Robert Vince', 'Anna McRoberts']","['Anna McRoberts', 'Robert Vince']",Brahm Wenger,Key Pix Productions,"['Walt Disney Studios', 'Home Entertainment']",,93 minutes,United States,English,,,93.0,,,2012-01-31,4.5,N/A,N/A,"['Richard Riehle', 'Edward Herrmann', 'Mason Cook', 'Adam Alexi-Malle', 'Mo Gallini', 'Christopher Maleki', 'Ranya Jaber', 'Anna Primiani']",Kamal Derkaoui,"January 31, 2012 ","['Anna McRoberts', 'Robert Vince']",Jason Pielak,,,,,,,,,,,,,,,,,,,,,,,,,,,,,,,,,
404,Arrietty,Hiromasa Yonebayashi,,"['The Borrowers', 'by', 'Mary Norton']",Toshio Suzuki,Cécile Corbel,Studio Ghibli,Toho,,95 minutes,Japan,Japanese,$23 million,$146 million,95.0,146000000.0,23000000.0,2010-07-17,7.6,80.0,94.0,Mirai ShidaRyunosuke KamikiShinobu OtakeKeiko TakeshitaTatsuya FujiwaraTomokazu MiuraKirin Kiki,Atsushi Okui,17 July 2010 ,,Keiko KadokawaRie MatsubaraHiromi SasakiTakeshi Seyama,,,Hayao MiyazakiKeiko Niwa,,,,,,,,,,,,,,,,,,,,,,,借りぐらしのアリエッティ,TranscriptionsRevised HepburnKarigurashi no Arietti,Karigurashi no Arietti,,,,,
405,John Carter,Andrew Stanton,,"['A Princess of Mars', 'by', 'Edgar Rice Burroughs']","Jim Morris, Colin Wilson, Lindsey Collins",Michael Giacchino,Walt Disney Pictures,"['Walt Disney Studios', 'Motion Pictures']","February 22, 2012",132 minutes,United States,English,"$306.6 million , $263.7 million ",$284.1 million,132.0,284100000.0,306600000.0,2012-02-22,6.6,51.0,52.0,"Taylor Kitsch, Lynn Collins, Samantha Morton, Mark Strong, Ciarán Hinds, Dominic West, James Purefoy, Willem Dafoe",Dan Mindel,,,Eric Zumbrunnen,,,"Andrew Stanton, Mark Andrews, Michael Chabon",,,,,,,,,,,,,,,,,,,,,,,,,,,,,,
406,Chimpanzee,"['Alastair Fothergill', 'Mark Linfield']",,,"['Alastair Fothergill', 'Mark Linfield', 'Alix Tidmarsh']",Nicholas Hooper,,Walt Disney Studios Motion Pictures,"April 20, 2012",77 minutes,,,$5 million,$34.8 million,77.0,34800000.0,5000000.0,2012-04-20,7.1,57.0,74.0,,"['Martyn Colbeck ', 'Bill Wallauer ']",,"['Alastair Fothergill', 'Mark Linfield', 'Don Hahn']",Andy Netley,"['English', 'French']",Tim Allen,,,"['United States', 'France', 'United Kingdom']",,,,,,,,,,"['Disneynature', 'Great Ape Productions']",,,,,,,,,,,,,,,,,,
407,Arjun: The Warrior Prince,Arnab Chaudhuri,,,"['Ronnie Screwvala', 'Siddharth Roy Kapur']","['Songs:', 'Vishal–Shekhar', 'Background Score:', 'Dhruv Ghanekar']",,UTV Motion Pictures,,96 minutes,India,Hindi,,,96.0,,,2012-05-25,6.8,N/A,67.0,,Hemant Chaturvedi,25 May 2012 ,Rajesh Devraj,A. Sreekar Prasad,,,,,,,,,,,,,,,"['Walt Disney Pictures', 'UTV Motion Pictures']",,,,,,,,,,,,,,,,,,
408,Brave,"Mark Andrews, Brenda Chapman",Brenda Chapman,,Katherine Sarafian,Patrick Doyle,Pixar Animation Studios,"['Walt Disney Studios', 'Motion Pictures']","June 10, 2012",93 minutes,United States,English,$185 million,$539 million,93.0,539000000.0,185000000.0,2012-06-10,7.1,69.0,79.0,"Kelly Macdonald, Emma Thompson, Billy Connolly, Julie Walters, Robbie Coltrane, Kevin McKidd, Craig Ferguson","Robert Anderson , Danielle Feinberg ",,,Nicholas C. Smith,,,"Mark Andrews, Steve Purcell, Brenda Chapman, Irene Mecchi",,,,,,,,,,,,,,,,,,,,,,,,,,,,,,
409,The Odd Life of Timothy Green,Peter Hedges,Ahmet Zappa,,"Scott Sanders, James Whitaker, Ahmet Zappa",Geoff Zanelli,,"['Walt Disney Studios', 'Motion Pictures']",,100 minutes,United States,English,$25 million,$56 million,100.0,56000000.0,25000000.0,2012-08-15,6.6,47.0,36.0,"Jennifer Garner, Joel Edgerton, Dianne Wiest, CJ Adams, Rosemarie DeWitt, Ron Livingston, David Morse, Common",John Toll,"August 15, 2012 ",,Andrew Mondshein,,,Peter Hedges,,,,,,,,,,,,"Walt Disney Pictures, Scott Sanders Productions",,,,,,,,,,,,,,,,,,
410,Beverly Hills Chihuahua 3: Viva la Fiesta!,Lev L. Spiro,,"['Characters', 'by', 'Jeff Bushell']","['David Hoberman', 'Sara E. White']",Heitor Pereira,Walt Disney Pictures,"['Walt Disney Studios', 'Home Entertainment']",,89 minutes,United States,English,,$12.2 million ,89.0,12200000.0,,2012-09-18,4.4,N/A,N/A,"['George Lopez', 'Odette Annable', 'Logan Grove', 'Emily Osment']",Greg Gardiner,"September 18, 2012 ",Dana Starfield,Matthew Colonna,,,,,,,,,,,,,,,,,,,,,,,,,,,,,,,,,
411,Frankenweenie,Tim Burton,,"['Frankenweenie', 'by', 'Lenny Ripps ', 'Tim Burton ']","Tim Burton, Allison Abbate",Danny Elfman,,"['Walt Disney Studios', 'Motion Pictures']","September 20, 2012",87 minutes,United States,English,$39 million,$81.5 million,87.0,81500000.0,39000000.0,2012-09-20,6.9,74.0,88.0,"Catherine O'Hara, Martin Short, Martin Landau, Charlie Tahan, Atticus Shaffer, Winona Ryder",Peter Sorg,,,"Chris Lebenzon, Mark Solomon",,,John August,,,,,,,,,,,,"['Walt Disney Pictures', 'Tim Burton Productions']",,,,,,,,,,,,,,,,,,
412,Secret of the Wings,Peggy Holmes,,"['Tinker Bell', 'by', 'J. M. Barrie']",Makul Wigert,Joel McNeely,DisneyToon Studios,"['Walt Disney Studios', 'Home Entertainment', 'Walt Disney Studios', 'Motion Pictures']","August 16, 2012",75 minutes,United States,English,$30—35 million,$67.5 million,75.0,67500000.0,30000000.0,2012-08-16,7.0,N/A,62.0,"Mae Whitman, Lucy Hale, Lucy Liu, Raven-Symoné, Megan Hilty, Angela Bartys, Timothy Dalton",,,,Mark Rosenbaum,,Anjelica Huston,"Bobs Gannaway, Peggy Holmes, Ryan Rowe, Tom Rogers",,,,,,,,,,,,,,,,,,,,,,,,,,,,,,
413,Wreck-It Ralph,Rich Moore,Rich MoorePhil JohnstonJim Reardon,,Clark Spencer,Henry Jackman,Walt Disney Animation Studios,Walt Disney Studios Motion Pictures,"October 29, 2012",101 minutes,United States,English,$165 million,$496.5 million,101.0,496500000.0,165000000.0,2012-10-29,7.7,72.0,87.0,John C. ReillySarah SilvermanJack McBrayerJane Lynch,Rob Dressel,,,Tim Mertens,,,Phil JohnstonJennifer Lee,,,,,,,,,,,,,,,,,,,,,,,,,,,,,,
414,Oz the Great and Powerful,Sam Raimi,Mitchell Kapner,"['Oz', 'by', 'L. Frank Baum']",Joe Roth,Danny Elfman,,"['Walt Disney Studios', 'Motion Pictures']","February 13, 2013",130 minutes,United States,English,$215 million,$493.3 million,130.0,493300000.0,215000000.0,2013-02-13,6.3,44.0,57.0,"James Franco, Mila Kunis, Rachel Weisz, Michelle Williams, Zach Braff, Bill Cobbs, Joey King, Tony Cox",Peter Deming,,,Bob Murawski,,,"Mitchell Kapner, David Lindsay-Abaire",,,,,,,,,,,,"Walt Disney Pictures, Roth Films",,,,,,,,,,,,,,,,,,
415,Wings of Life,Louis Schwartzberg,,,"['Grady Candler', 'Alix Tidmarsh']","['Steffen Aaskoven & Marc-George Andersen', 'Bliss']",,"['Walt Disney Studios Motion Pictures France', 'Walt Disney Studios Home Entertainment']",16 March 2011,77 minutes,,,,,77.0,,,2011-03-16,7.3,N/A,N/A,,,,,Jonathan P. Shaw,"['French', 'English']","['Mélanie Laurent', 'Meryl Streep']",,,"['France', 'United States']",,,,,,,,,,"['Walt Disney Pictures', 'Disneynature', 'Blacklight Films']",,,,,,,,,,,,,,,,,,
416,Monsters University,Dan Scanlon,"Dan Scanlon, Dan Gerson, Robert L. Baird",,Kori Rae,Randy Newman,Pixar Animation Studios,"['Walt Disney Studios', 'Motion Pictures']","June 5, 2013",104 minutes,United States,English,$200 million,$743.6 million,104.0,743600000.0,200000000.0,2013-06-05,7.2,65.0,80.0,"Billy Crystal, John Goodman, Steve Buscemi, Helen Mirren, Peter Sohn, Joel Murray, Sean Hayes, Dave Foley, Charlie Day, Nathan Fillion","Matt Aspbury , Jean-Claude Kalache ",,,Greg Snyder,,,"Dan Gerson, Robert L. Baird, Dan Scanlon",,,,,,,,,,,,,,,,,,,,,,,,,,,,,,
417,The Lone Ranger,Gore Verbinski,"Ted Elliott, Terry Rossio, Justin Haythe","['The Lone Ranger', 'by', 'Fran Striker', 'George W. Trendle']","Jerry Bruckheimer, Gore Verbinski",Hans Zimmer,,"['Walt Disney Studios', 'Motion Pictures']","June 22, 2013",149 minutes,United States,English,$225–250 million,$260.5 million,149.0,260500000.0,225000000.0,2013-06-22,6.4,37.0,31.0,"Johnny Depp, Armie Hammer, Tom Wilkinson, William Fichtner, Barry Pepper, James Badge Dale, Helena Bonham Carter",Bojan Bazelli,,,"James Haygood, Craig Wood",,,"Justin Haythe, Ted Elliott, Terry Rossio",,,,,,,,,,,,"Walt Disney Pictures, Jerry Bruckheimer Films, Blind Wink Productions, Infinitum Nihil",,,,,,,,,,,,,,,,,,
418,Planes,Klay Hall,John LasseterKlay HallJeffrey M. Howard,,Traci Balthazor-Flynn,Mark Mancina,,"['Walt Disney Studios', 'Motion Pictures']","August 2, 2013",92 minutes,United States,English,$50 million,$240.2 million,92.0,240200000.0,50000000.0,2013-08-02,5.7,39.0,26.0,Dane CookStacy KeachPriyanka ChopraTeri HatcherBrad GarrettJulia Louis-DreyfusRoger Craig SmithJohn CleeseCarlos AlazraquiAnthony EdwardsSinbadVal Kilmer,,,,Jeremy Milton,,,Jeffrey M. Howard,,,,,,,,,,,,"['Walt Disney Pictures', 'Disneytoon Studios']",,,,,,,,,,,,,,,,,,
419,Super Buddies,Robert Vince,,"['Characters', 'by Paul Tamasy', 'Aaron Mendelsohn', 'Kevin DiCicco', 'Robert Vince', 'Anna McRoberts']",Anna McRobertsRobert Vince,Brahm Wenger,,Walt Disney Studios Home Entertainment,,81 minutes,United States,English,,,81.0,,,2013-08-27,4.3,N/A,N/A,John RatzenbergerTrey LoneyVeronica Diaz-CarranzaJay BrazeauJason EarlesJonathan Morgan HeitHarley GrahamDarien ProvostSam AdlerMichael TeigenJake BrennanKimberley SustadSean Mathieson,Mark Irwin,"August 27, 2013 ",Anna McRobertsRobert Vince,Kelly Herron,,,,,,,,,,,,,,,Walt Disney PicturesKey Pix Productions,,,,,,,,,,,,,,,,,,
420,Frozen,"Chris Buck, Jennifer Lee","Chris Buck, Jennifer Lee, Shane Morris","['The Snow Queen', 'by', 'Hans Christian Andersen']",Peter Del Vecho,Christophe Beck,Walt Disney Animation Studios,"['Walt Disney Studios', 'Motion Pictures']","November 19, 2013",102 minutes,United States,English,$150 million,$1.280 billion,102.0,1280000000.0,150000000.0,2013-11-19,7.4,75.0,90.0,"Kristen Bell, Idina Menzel, Jonathan Groff, Josh Gad, Santino Fontana","['Scott Beattie ', 'Mohit Kallianpur ']",,,Jeff Draheim,,,Jennifer Lee,,,,,,,,,,,,,,,,,,,,,,,,,,,,,,
