,title,Directed by,Story by,Based on,Produced by,Music by,Production company,Distributed by,Release dates,Running time,Country,Language,Budget,Box office,Running time(int),Box office(float),Budget(float),Release date (Datetime),IMDb rating,Meta Score,Rotten Tomatoes (%),Starring,Cinematography,Release date,Written by,Edited by,Languages,Narrated by,Screenplay by,Adaptation by,Countries,Color process,Genre,Created by,Country of origin,No.  of seasons,No.  of episodes,Executive producers,Network,Release,Production companies,Original language,Producer,Developed by,Voices of,Theme music composer,Opening theme,Ending theme,Composer,Producers,Editor,Kanji,Transcriptions,Revised Hepburn,Traditional Chinese,Simplified Chinese,Literal meaning,Original title,Layouts by
150,Condorman,Charles Jarrott,,"['The Game of X', 'by', 'Robert Sheckley']",Jan Williams,Henry Mancini,Walt Disney Productions,Buena Vista Distribution,"July 2, 1981",90 minutes,United States,English,$14 million,,90.0,,14000000.0,1981-07-02,5.7,46.0,27.0,Michael CrawfordOliver ReedBarbara CarreraJames HamptonJean-Pierre KalfonDana Elcar,Charles F. Wheeler,,,Gordon D. Brenner,,,Marc Stirdivant,,,,,,,,,,,,,,,,,,,,,,,,,,,,,,
151,Night Crossing,Delbert Mann,,,Tom Leetch,Jerry Goldsmith,Walt Disney Productions,Buena Vista Distribution,,107 minutes,,English,$10 million,$8 million,107.0,8000000.0,10000000.0,1982-02-05,6.5,N/A,80.0,"John Hurt, Jane Alexander, Glynnis O'Connor, Doug McKeon, Beau Bridges, Ian Bannen",Tony Imi,"February 5, 1982 ",John McGreevey,Gordon D. Brenner,,,,,"['United Kingdom', 'United States']",,,,,,,,,,,,,,,,,,,,,,,,,,,,
152,Tron,Steven Lisberger,"Steven Lisberger, Bonnie MacBird",,Donald Kushner,Wendy Carlos,,Buena Vista Distribution,,96 minutes,United States,English,$17 million,$50 million,96.0,50000000.0,17000000.0,1982-07-09,6.7,58.0,73.0,"Jeff Bridges, Bruce Boxleitner, David Warner, Cindy Morgan, Barnard Hughes",Bruce Logan,"July 9, 1982 ",,Jeff Gourson,,,Steven Lisberger,,,,,,,,,,,,"Walt Disney Productions, Lisberger-Kushner Productions",,,,,,,,,,,,,,,,,,
153,Tex,Tim Hunter,,"['Tex', 'by', 'S. E. Hinton']",Tim Zinnemann,Pino Donaggio,Walt Disney Productions,Buena Vista Distribution Company,,103 minutes,United States,English,$5 million,$7.4 million,103.0,7400000.0,5000000.0,1982-07-30,6.4,78.0,85.0,"Matt Dillon, Jim Metzler, Meg Tilly, Bill McKinney, Ben Johnson",Ric Waite,"July 30, 1982 ",,Howard E. Smith,,,"Charles S. Haas, Tim Hunter",,,,,,,,,,,,,,,,,,,,,,,,,,,,,,
154,Trenchcoat,Michael Tuchner,,,Jerry Leider,Charles Fox,Walt Disney Productions ,Buena Vista Distribution,,91 min,United States,English,$8 million,"$4,304,286 ",91.0,4304286.0,8000000.0,1983-03-11,5.3,N/A,N/A,"Margot Kidder, Robert Hays, David Suchet, Gila von Weitershausen, Ronald Lacey",Tonino Delli Colli,"March 11, 1983 ","['Jeffrey Price', 'Peter S. Seaman']",Frank J. Urioste,,,,,,,,,,,,,,,,,,,,,,,,,,,,,,,,,
155,Something Wicked This Way Comes,Jack Clayton,,"['Something Wicked This Way Comes', 'by Ray Bradbury']",Peter Douglas,James Horner,,Buena Vista Distribution,,95 minutes,United States,English,$20 million,$8.4 million,95.0,8400000.0,20000000.0,1983-04-29,6.7,68.0,61.0,"Jason Robards, Jonathan Pryce, Diane Ladd, Pam Grier",Stephen H. Burum,"April 29, 1983  ",,Barry Mark GordonArt J. Nelson,,,Ray Bradbury,,,,,,,,,,,,Walt Disney ProductionsThe Bryna Company,,,,,,,,,,,,,,,,,,
156,Never Cry Wolf,Carroll Ballard,,"['Never Cry Wolf', 'by', 'Farley Mowat']","['Lewis Allen', 'Jack Couffer', 'Joseph Strick']",Mark Isham,,Buena Vista Distribution,"October 7, 1983",105 minutes,United States,,$11 million,$27.6 million,105.0,27600000.0,11000000.0,1983-10-07,7.5,N/A,100.0,"Charles Martin Smith, Brian Dennehy",Hiro Narita,,,"['Michael Chandler', 'Peter Parasheles']","['English', 'Inuktitut']",,"['Curtis Hanson', 'Sam Hamm', 'Richard Kletter']",,,,,,,,,,,,"['Walt Disney Pictures', 'Amarok Productions Ltd.']",,,,,,,,,,,,,,,,,,
157,Return to Oz,Walter Murch,,"['The Marvelous Land of Oz', 'and', 'Ozma of Oz', 'by', 'L. Frank Baum']",Paul Maslansky,David Shire,,Buena Vista Distribution,,113 minutes,,English,$28 million,$11.1 million ,113.0,11100000.0,28000000.0,1985-06-21,6.7,42.0,58.0,"Nicol Williamson, Jean Marsh, Piper Laurie, Fairuza Balk","['David Watkin', 'Freddie Francis']","June 21, 1985  ",,Leslie Hodgson,,,"['Walter Murch', 'Gill Dennis']",,"['United States', 'United Kingdom']",,,,,,,,,,"['Walt Disney Pictures', 'Silver Screen Partners']",,,,,,,,,,,,,,,,,,
158,The Black Cauldron,"Ted Berman, Richard Rich","Ted Berman, Vance Gerry, Joe Hale, David Jonas, Roy Morita, Richard Rich, Art Stevens, Al Wilson, Peter Young","The Book of Three and, The Black Cauldron by, Lloyd Alexander",Joe Hale,Elmer Bernstein,,Buena Vista Distribution,,80 minutes,United States,English,$44 million,$21.3 million,80.0,21300000.0,44000000.0,1985-07-24,6.3,59.0,54.0,"Grant Bardsley, Susan Sheridan, Freddie Jones, Nigel Hawthorne, Arthur Malet, John Byner, Lindsay Rich, Brandon Call, Gregory Levinson, Eda Reiss Merin, Adele Maus-Morey, Billie Hayes, Phil Fondacaro, Peter Renaday, James Almanzar, Wayne Allwine, Steve Hale, Phil Nibbelink, Jack Laing, John Hurt",,"July 24, 1985 ",,"James Melton, Jim Koford, Armetta Jackson",,John Huston,,,,,,,,,,,,,"['Walt Disney Pictures', 'Walt Disney Productions', 'Silver Screen Partners II']",,,,,,,,,,,,,,,,,,
159,The Journey of Natty Gann,Jeremy Kagan,,,Mike Lobell,James Horner,,Buena Vista Distribution,,101 minutes,United States,English,$8 million,$9.7 million ,101.0,9700000.0,8000000.0,1985-09-27,7.0,66.0,91.0,"Meredith Salenger, John Cusack, Ray Wise",Dick Bush,"September 27, 1985 ",Jeanne Rosenberg,David Holden,,,,,,,,,,,,,,,"['Walt Disney Pictures', 'Silver Screen Partners II']",,,,,,,,,,,,,,,,,,
160,One Magic Christmas,Phillip Borsos,"['Thomas Meehan', 'Phillip Borsos', 'Barry Healey']",,Peter O'Brian,Michael Conway Baker,,Buena Vista Distribution,,90 minutes,,English,$7.5 million,$13 million ,90.0,13000000.0,7500000.0,1985-11-22,6.4,N/A,47.0,"Mary Steenburgen, Gary Basaraba, Michelle Meyrink, Elisabeth Harnois, Arthur Hill, Harry Dean Stanton",Frank Tidy,"November 22, 1985 ",,Sidney Wolinsky,,,Thomas Meehan,,"['Canada', 'United States']",,,,,,,,,,"['Walt Disney Pictures', 'Silver Screen Partners II', 'Telefilm Canada']",,,,,,,,,,,,,,,,,,
161,The Great Mouse Detective,"John Musker, Ron Clements, Dave Michener, Burny Mattinson","Pete Young, Vance Gerry, Steve Hulett, Ron Clements, John Musker, Bruce M. Morris, Matthew O'Callaghan, Burny Mattinson, Dave Michener, Melvin Shaw","['Basil of Baker Street', 'by', 'Eve Titus', 'Paul Galdone']",Burny Mattinson,Henry Mancini,Walt Disney Feature Animation,Buena Vista Distribution,,74 minutes,United States,English,$14 million,$38.7 million,74.0,38700000.0,14000000.0,1986-07-02,7.1,73.0,78.0,"Vincent Price, Barrie Ingham, Val Bettin, Susanne Pollatschek, Candy Candido, Diana Chesney, Eve Brenner, Alan Young",,"July 2, 1986 ",,"Roy M. Brewer Jr., James Melton",,,,,,,,,,,,,,,,,,,,,,,,,,,,,,,,,
162,Flight of the Navigator,Randal Kleiser,Mark H. Baker,,"Dimitri Villard, Robert Wald",Alan Silvestri,,"['Buena Vista Distribution', 'PSO Productions']",,90 minutes,United States,English,$9 million,$18.6 million,90.0,18600000.0,9000000.0,1986-08-01,6.9,64.0,84.0,Joey Cramer,James Glennon,"August 1, 1986 ",,"Jeff Gourson, Janice Parker",,,"Michael Burton, Matt MacManus",,,,,,,,,,,,"['PSO Productions', 'Viking Film AS']",,,,,,,,,,,,,,,,,,
163,Fluppy Dogs,Fred Wolf,,,,Shirley Walker,Walt Disney Television Animation,,,44 minutes,,,,,44.0,,,,7.4,N/A,N/A,"['Marshall Efron', 'Lorenzo Music', 'Susan Blu', 'Hal Smith', 'Michael Rye']",,,"['Haskell Barkin', 'Bruce Talkington']",,,,,,,,,,United States,,,,ABC,"November 27, 1986 ",,English,Fred Wolf,,,,,,,,,,,,,,,,
164,Benji the Hunted,Joe Camp,,,Ben Vaughn,"['Betty Box', 'Euel Box']",,Buena Vista Pictures Distribution,,89 minutes,United States,English,,"$15,2 million",89.0,152000000.0,,1987-06-05,6.2,53.0,55.0,"['Red Steagall', 'Frank Inn', 'Nancy Francis']",Don Reddy,"June 5, 1987 ",Joe Camp,Karen Thorndike,,,,,,,,,,,,,,,"['Walt Disney Pictures', 'Mulberry Square Productions', 'Silver Screen Partners III']",,,,,,,,,,,,,,,,,,
165,The Man from Snowy River II,Geoff Burrowes,,,Geoff Burrowes,Bruce Rowland,,"Hoyts Distribution , Walt Disney Pictures ",24 March 1988,110 minutes,Australia,English,A$8.7 million,"$13,687,027",110.0,13687027.0,8700000.0,1988-03-24,N/A,N/A,N/A,"Tom Burlinson, Sigrid Thornton, Brian Dennehy, Nicholas Eadie, Bryan Marshall, Mark Hembrow",Keith Wagstaff,,"['Banjo Paterson', 'Geoff Burrowes', 'John Dixon']",Gary Woodyard,,,,,,,,,,,,,,,"Burrowes Film Group, The Hoyts Group, Silver Screen Partners III",,,,,,,,,,,,,,,,,,
166,Oliver & Company,George Scribner,"Vance Gerry, Mike Gabriel, Joe Ranft, Jim Mitchell, Chris Bailey, Kirk Wise, Dave Michener, Roger Allers, Gary Trousdale, Kevin Lima, Michael Cedeno, Pete Young, Leon Joosen","['Oliver Twist', 'by', 'Charles Dickens']",Kathleen Gavin,J. A. C. Redford,Walt Disney Feature Animation,Buena Vista Pictures Distribution,,74 minutes,United States,English,$31 million,>$121 million,74.0,121000000.0,31000000.0,1988-11-18,6.6,58.0,53.0,"Joey Lawrence, Billy Joel, Cheech Marin, Richard Mulligan, Roscoe Lee Browne, Sheryl Lee Ralph, Dom DeLuise, Taurean Blacque, Carl Weintraub, Robert Loggia, Natalie Gregory, William Glover, Bette Midler",,"November 18, 1988 ",,"Mark Hester, James Melton",,,"Jim Cox, Timothy J. Disney, James Mangold",,,,,,,,,,,,,,,,,,,,,,,,,,,,,,
167,"Honey, I Shrunk the Kids",Joe Johnston,"['Stuart Gordon', 'Brian Yuzna', 'Ed Naha']",,Penney Finkelman Cox,James Horner,,Buena Vista Pictures Distribution,,93 minutes,United States,English,$18 million,$222.7 million,93.0,222700000.0,18000000.0,1989-06-23,6.4,63.0,76.0,"Rick Moranis, Marcia Strassman, Matt Frewer, Kristine Sutherland, Amy O'Neill, Robert Oliveri, Thomas Wilson, Jared Rushton",Hiro Narita,"June 23, 1989 ",,Michael A. Stevenson,,,"['Ed Naha', 'Tom Schulman']",,,,,,,,,,,,"['Walt Disney Pictures', 'Silver Screen Partners III']",,,,,,,,,,,,,,,,,,
168,Cheetah,Jeff Blyth,John Cotter,"['The Cheetahs', 'by', 'Alan Caillou']","Roy E. Disney, Robert Halmi, Sr.",Bruce Rowland,,Buena Vista Pictures Distribution,,84 minutes,United States,English,$5 million,"$8,153,677 ",84.0,8153677.0,5000000.0,1989-08-18,5.9,N/A,43.0,"Keith Coogan, Lucy Deakins, Collin Mothupi",Thomas Burstyn,"August 18, 1989 ",,Eric Albertson,,,"Erik Tarloff, John Cotter, Griff Du Rhone",,,,,,,,,,,,"['Walt Disney Pictures', 'Silver Screen Partners III']",,,,,,,,,,,,,,,,,,
169,The Little Mermaid,"John Musker, Ron Clements",,"['The Little Mermaid', 'by', 'Hans Christian Andersen']","Howard Ashman, John Musker",Alan Menken,Walt Disney Feature Animation,Buena Vista Pictures Distribution,,83 minutes,United States,English,$40 million,$235 million,83.0,235000000.0,40000000.0,1989-11-17,7.6,88.0,91.0,"René Auberjonois, Christopher Daniel Barnes, Jodi Benson, Pat Carroll, Paddi Edwards, Buddy Hackett, Jason Marin, Kenneth Mars, Ben Wright, Samuel E. Wright",,"November 17, 1989 ","John Musker, Ron Clements",Mark Hester,,,,,,,,,,,,,,,,,,,,,,,,,,,,,,,,,
170,DuckTales the Movie: Treasure of the Lost Lamp,Bob Hathcock,,"['DuckTales', 'by', 'Jymn Magon']",Bob Hathcock,David Newman,,Buena Vista Pictures Distribution,,69 minutes,United States,English,$20 million,$18.1 million,69.0,18100000.0,20000000.0,1990-08-03,6.8,N/A,100.0,"Alan Young, Terrence McGovern, Russi Taylor, Richard Libertini, Christopher Lloyd, June Foray, Chuck McCann, Joan Gerber, Rip Taylor",,"August 3, 1990 ",,Charles King,,,Alan Burnett,,,,,,,,,,,,"Disney MovieToons, Walt Disney Animation France, Walt Disney Pictures",,,,,,,,,,,,,,,,,,
171,The Rescuers Down Under,"Hendel Butoy, Mike Gabriel",,"['Characters', 'by', 'Margery Sharp']",Thomas Schumacher,Bruce Broughton,Walt Disney Feature Animation,"Buena Vista Pictures Distribution, Inc.",,77 minutes,United States,English,,$47.4 million,77.0,47400000.0,,1990-11-16,6.8,70.0,72.0,"Bob Newhart, Eva Gabor, John Candy, Adam Ryen, George C. Scott, Tristan Rogers",,"November 16, 1990 ",,Michael Kelly,,,"Jim Cox, Karey Kirkpatrick, Byron Simpson, Joe Ranft",,,,,,,,,,,,,,,,,,,,,,,,,,,,,,
172,White Fang,Randal Kleiser,,"['White Fang', 'by', 'Jack London']",Markay Powell,"['Basil Poledouris', 'Hans Zimmer']",,Buena Vista Pictures Distribution,,107 minutes,United States,English,$14 million,$41 million,107.0,41000000.0,14000000.0,1991-01-18,6.7,62.0,67.0,"Ethan Hawke, Klaus Maria Brandauer, Seymour Cassel, James Remar, Susan Hogan",Tony Pierce-Roberts,"January 18, 1991 ",,Lisa Day,,,"['Jeanne Rosenberg', 'Nick Thiel', 'David Fallon']",,,,,,,,,,,,"['Walt Disney Pictures', 'Silver Screen Partners IV']",,,,,,,,,,,,,,,,,,
173,Shipwrecked,Nils Gaup,,,"['John M. Jacobsen', 'Nigel Wooll']",Patrick Doyle,,Buena Vista Pictures Distribution,3 October 1990 1990-10-03 1 March 1991 1 August 1991,93 minutes,,,60 million Norwegian Kroner ,$17 million ,93.0,17000000.0,60000000.0,,6.5,N/A,N/A,"Stian Smestad, Gabriel Byrne",Erling Thurmann-Andersen,,"['O.V. Falck-Ytter', 'Nils Gaup', 'Bob Foss', 'Greg Dinner', 'Nick Thiel']",Nils Pagh Andersen,"['Norwegian', 'English']",,,,"['Norway', 'Sweden', 'United States']",,,,,,,,,,"['Walt Disney Pictures', 'AB Svensk Filmindustri']",,,,,,,,,,,,,,,,,,
174,Wild Hearts Can't Be Broken,Steve Miner,,"['A Girl and Five Brave Horses', 'by', 'Sonora Webster Carver']",Matt Williams,Mason Daring,Walt Disney Pictures,Buena Vista Pictures Distribution,,88 minutes,United States,English,,$7.3 million,88.0,7300000.0,,1991-05-24,7.2,N/A,73.0,"Gabrielle Anwar, Michael Schoeffling, Cliff Robertson",Daryn Okada,"May 24, 1991 ","['Matt Williams', 'Oley Sassone']",Jon Poll,,,,,,,,,,,,,,,,,,,,,,,,,,,,,,,,,
175,The Rocketeer,Joe Johnston,"Danny Bilson, Paul De Meo, William Dear","['The Rocketeer', 'by', 'Dave Stevens']","Charles Gordon, Lawrence Gordon, Lloyd Levin",James Horner,,Buena Vista Pictures Distribution,,108 minutes,United States,English,$35–40 million,$46.7 million ,108.0,46700000.0,35000000.0,1991-06-21,6.6,61.0,67.0,"Billy Campbell, Alan Arkin, Jennifer Connelly, Paul Sorvino, Timothy Dalton",Hiro Narita,"June 21, 1991 ",,"Michael A. Stevenson, Arthur Schmidt",,,"Danny Bilson, Paul De Meo",,,,,,,,,,,,"Walt Disney Pictures, Touchstone Pictures, Silver Screen Partners IV, Gordon Company",,,,,,,,,,,,,,,,,,
176,Beauty and the Beast,"Gary Trousdale, Kirk Wise","Brenda Chapman, Chris Sanders, Burny Mattinson, Kevin Harkey, Brian Pimental, Bruce Woodside, Joe Ranft, Tom Ellery, Kelly Asbury, Robert Lence","['Beauty and the Beast', 'by', 'Jeanne-Marie Leprince de Beaumont']",Don Hahn,Alan Menken,Walt Disney Feature Animation,"Buena Vista Pictures Distribution, Inc.","September 29, 1991",84 minutes,United States,English,$25 million,$424 million,84.0,424000000.0,25000000.0,1991-09-29,8.0,95.0,93.0,"Paige O'Hara, Robby Benson, Richard White, Jerry Orbach, David Ogden Stiers, Angela Lansbury, Rex Everhart, Jesse Corti, Jo Anne Worley",,,,John Carnochan,,,Linda Woolverton,,,,,,,,,,,,,,,,,,,,,,,,,,,,,,
177,Newsies,Kenny Ortega,,,Michael Finnell,"Alan Menken, J. A. C. Redford",,Buena Vista Pictures Distribution,,121 minutes,United States,English,$15 million,$2.8 million,121.0,2800000.0,15000000.0,1992-04-10,6.9,46.0,39.0,"Christian Bale, Bill Pullman, Ann-Margret, Robert Duvall",Andrew Laszlo,"April 10, 1992 ","Bob Tzudiker, Noni White",William H. Reynolds,,,,,,,,,,,,,,,"Walt Disney Pictures, Touchwood Pacific Partners I",,,,,,,,,,,,,,,,,,
178,"Honey, I Blew Up the Kid",Randal Kleiser,Garry Goodrow,"['Characters', 'by', 'Stuart Gordon', 'Brian Yuzna', 'Ed Naha']","['Dawn Steel', 'Edward S. Feldman']",Bruce Broughton,,Buena Vista Pictures Distribution,,89 minutes,United States,English,$32 million,$96 million,89.0,96000000.0,32000000.0,1992-07-17,4.9,50.0,40.0,"Rick Moranis, Marcia Strassman, Lloyd Bridges, Robert Oliveri, John Shea",John Hora,"July 17, 1992 ",,"['Michael A. Stevenson', 'Harry Hitner']",,,"['Garry Goodrow', 'Thom Eberhardt', 'Peter Elbling']",,,,,,,,,,,,"['Walt Disney Pictures', 'Touchwood Pacific Partners']",,,,,,,,,,,,,,,,,,
179,The Mighty Ducks,Stephen Herek,,,"Jon Avnet, Jordan Kerner",David Newman,,Buena Vista Pictures Distribution,,104 minutes,United States,English,$14 million,$50.8 million,104.0,50800000.0,14000000.0,1992-10-02,6.6,46.0,23.0,"Emilio Estevez, Joss Ackland, Lane Smith",Thomas Del Ruth,"October 2, 1992 ",Steven Brill,"Larry Bock, John F. Link",,,,,,,,,,,,,,,"Walt Disney Pictures, Avnet–Kerner Productions, Touchwood Pacific Partners",,,,,,,,,,,,,,,,,,
180,Aladdin,"John Musker, Ron Clements",Burny MattinsonRoger AllersDaan JippesKevin HarkeySue NicholsFrancis GlebasDarrell RooneyLarry LekerJames FujiiKirk HansonKevin LimaRebecca ReesDavid S. SmithChris SandersBrian PimentalPatrick A. Ventura,"""Aladdin and the Magic Lamp"" from One Thousand and One Nights","John Musker, Ron Clements",Alan Menken,Walt Disney Feature Animation,Buena Vista Pictures Distribution,,90 minutes,United States,English,$28 million,$504.1 million,90.0,504100000.0,28000000.0,1992-11-11,8.0,86.0,95.0,"Scott Weinger, Robin Williams, Linda Larkin, Jonathan Freeman, Frank Welker, Gilbert Gottfried, Douglas Seale",,"November 11, 1992 ",,H. Lee Peterson,,,"Ron Clements, John Musker, Ted Elliott, Terry Rossio",,,,,,,,,,,,,,,,,,,,,,,,,,,,,,
181,The Muppet Christmas Carol,Brian Henson,,"['The Muppet Show', 'by', 'Jim Henson', 'A Christmas Carol', 'by', 'Charles Dickens']","Brian Henson, Martin G. Baker",Miles Goodman,,Buena Vista Pictures Distribution,,86 minutes,United States,English,$12 million,$27.2 million,86.0,27200000.0,12000000.0,1992-12-11,7.8,64.0,77.0,"Michael Caine, Dave Goelz, Steve Whitmire, Jerry Nelson, Frank Oz",John Fenner,"December 11, 1992 ",,Michael Jablow,,,Jerry Juhl,,,,,,,,,,,,"Walt Disney Pictures, Jim Henson Productions",,,,,,,,,,,,,,,,,,
182,Homeward Bound: The Incredible Journey,Duwayne Dunham,,"['The Incredible Journey', 'by', 'Sheila Burnford']","['Jeffrey Chernov', 'Franklin R. Levy']",Bruce Broughton,Walt Disney Pictures,Buena Vista Pictures Distribution,,84 minutes,United States,English,,$57 million,84.0,57000000.0,,1993-02-03,6.9,N/A,87.0,"Robert Hays, Kim Greist, Veronica Lauren, Kevin Chevalia, Benj Thall",Reed Smoot,"February 3, 1993 ",,Jonathan P. Shaw,,,"['Caroline Thompson', 'Linda Woolverton', 'Jonathan Roberts', 'uncredited']",,,,,,,,,,,,,,,,,,,,,,,,,,,,,,
183,A Far Off Place,Mikael Salomon,,"['A Story Like the Wind', 'and', 'A Far Off Place', 'by', 'Laurens van der Post']","['Eva Monley', 'Elaine Sperber']",James Horner,,Buena Vista Pictures Distribution,,108 minutes,United States,English,,$12.9 million,108.0,12900000.0,,1993-03-12,6.5,N/A,42.0,"Reese Witherspoon, Ethan Randall, Sarel Bok, Jack Thompson, Maximilian Schell",Juan Ruiz Anchía,"March 12, 1993 ",,Ray Lovejoy,,,"['Robert Caswell', 'Jonathan Hensleigh', 'Sally Robinson']",,,,,,,,,,,,"['Walt Disney Pictures', 'Amblin Entertainment', 'Touchwood Pacific Partners']",,,,,,,,,,,,,,,,,,
184,The Adventures of Huck Finn,Stephen Sommers,,"['Adventures of Huckleberry Finn', 'by', 'Mark Twain']",Laurence Mark,Bill Conti,Walt Disney Pictures,Buena Vista Pictures Distribution,,107 minutes,United States,English,$11 million,$24.1 million,107.0,24100000.0,11000000.0,1993-04-02,6.2,N/A,75.0,"Elijah Wood, Courtney B. Vance, Robbie Coltrane, Jason Robards",Janusz Kamiński,"April 2, 1993 ",,Bob Ducsay,,,Stephen Sommers,,,,,,,,,,,,,,,,,,,,,,,,,,,,,,
185,Hocus Pocus,Kenny Ortega,"David Kirschner, Mick Garris",,"David Kirschner, Steven Haft",John Debney,,Buena Vista Pictures Distribution,,96 minutes,United States,English,$28 million,$50.8 million,96.0,50800000.0,28000000.0,1993-07-16,6.9,43.0,40.0,"Bette Midler, Sarah Jessica Parker, Kathy Najimy, Omri Katz, Thora Birch, Vinessa Shaw",Hiro Narita,"July 16, 1993 ",,Peter E. Berger,,,"Mick Garris, Neil Cuthbert",,,,,,,,,,,,"Walt Disney Pictures, Touchwood Pacific Partners 1",,,,,,,,,,,,,,,,,,
186,Cool Runnings,Jon Turteltaub,Lynn SiefertMichael Ritchie,,"Dawn Steel, Chris Meledandri",Hans Zimmer,Walt Disney Pictures,Buena Vista Pictures Distribution,,98 minutes,United States,English,$17 million,$154.9 million,98.0,154900000.0,17000000.0,1993-10-01,7.0,60.0,76.0,"Leon, Doug E. Doug, Rawle D. Lewis, Malik Yoba, John Candy",Phedon Papamichael,"October 1, 1993 ",,Bruce Green,,,"Lynn Siefert, Tommy Swerdlow, Michael Goldberg",,,,,,,,,,,,,,,,,,,,,,,,,,,,,,
187,The Three Musketeers,Stephen Herek,,"['The Three Musketeers', '1844 novel', 'by', 'Alexandre Dumas']","['Joe Roth', 'Roger Birnbaum']",Michael Kamen,,Buena Vista Pictures Distribution,,105 minutes,,English,$30 million,$111 million,105.0,111000000.0,30000000.0,1993-11-12,5.7,35.0,N/A,"Charlie Sheen, Kiefer Sutherland, Chris O'Donnell, Oliver Platt, Tim Curry, Rebecca De Mornay",Dean Semler,"November 12, 1993 ",,John F. Link,,,David Loughery,,"['United States', 'Austria']",,,,,,,,,,"['Walt Disney Pictures', 'Caravan Pictures']",,,,,,,,,,,,,,,,,,
188,Iron Will,Charles Haid,,,"['Patrick Palmer', 'Robert Schwartz']",Joel McNeely,Walt Disney Pictures,Buena Vista Pictures Distribution,,109 minutes,United States,English,,$21 million,109.0,21000000.0,,1994-01-14,6.6,56.0,67.0,"Mackenzie Astin, Kevin Spacey, David Ogden Stiers",William Wages,"January 14, 1994 ","['John Michael Hayes', 'Djordje Milicevic', 'Jeff Arch']",Andrew Doerfer,,,,,,,,,,,,,,,,,,,,,,,,,,,,,,,,,
189,Blank Check,Rupert Wainwright,,,"['Tony Shimkin', 'Gary Adelson', 'Craig Baumgarten']",Nicholas Pike,Walt Disney Pictures,Buena Vista Pictures Distribution,,94 minutes,United States,English,$13 million,$39 million,94.0,39000000.0,13000000.0,1994-02-11,5.3,42.0,9.0,"Brian Bonsall, Karen Duffy, Miguel Ferrer, James Rebhorn, Tone Lōc, Jayne Atkinson, Michael Lerner",Bill Pope,"February 11, 1994 ","['Colby Carr', 'Blake Snyder']","['Jill Savitt', 'Hubert de la Bouillerie']",,,,,,,,,,,,,,,,,,,,,,,,,,,,,,,,,
190,D2: The Mighty Ducks,Sam Weisman,,"['Characters', 'by Steven Brill']","['Jon Avnet', 'Jordan Kerner']",J. A. C. Redford,,Buena Vista Pictures Distribution,,106 minutes,United States,English,,$45.6 million,106.0,45600000.0,,1994-03-25,6.1,N/A,20.0,"Emilio Estevez, Michael Tucker, Jan Rubeš, Kathryn Erbe",Mark Irwin,"March 25, 1994 ",Steven Brill,"['John F. Link', 'Eric Sears']",,,,,,,,,,,,,,,"['Walt Disney Pictures', 'Avnet–Kerner Productions']",,,,,,,,,,,,,,,,,,
191,White Fang 2: Myth of the White Wolf,Ken Olin,,,Preston Fischer,John Debney,Walt Disney Pictures,Buena Vista Pictures Distribution,,102 minutes,United States,English,,$8.9 million,102.0,8900000.0,,1994-04-14,5.4,N/A,71.0,"Scott Bairstow, Charmaine Craig , Alfred Molina, Geoffrey Lewis",Hiro Narita,"April 14, 1994 ",David Fallon,Elba Sanchez-Short,,,,,,,,,,,,,,,,,,,,,,,,,,,,,,,,,
192,The Return of Jafar,"Toby Shelton, Tad Stones, Alan Zaslove","Duane Capizzi, Doug Langdale, Mark McCorkle, Robert Schooley, Tad Stones",,"Tad Stones, Alan Zaslove",Mark Watters,,Buena Vista Home Video,,69 minutes,United States,English,$5 million,,69.0,,5000000.0,1994-05-20,5.9,N/A,33.0,"Gilbert Gottfried, Jason Alexander, Jonathan Freeman, Scott Weinger, Linda Larkin, Dan Castellaneta",,"May 20, 1994 ","Kevin Campbell, Mirith J.S. Colao, Bill Motz, Steve Roberts, Dev Ross, Bob Roth, Jan Strnad, Brian Swenlin","Robert S. Birchard, Elen Orson",,,,,,,,,,,,,,,"['Walt Disney Television Animation', 'Walt Disney Home Video']",,,,,,,,,,,,,,,,,,
193,The Lion King,"Roger Allers, Rob Minkoff","Barry Johnson, Andy Gaskill, Kevin Harkey, Tom Sito, Rick Maki, Burny Mattinson, Lorna Cook, Gary Trousdale, Jorgen Klubien, Larry Leker, Ed Gombert, Mark Kausler, Thom Enriquez, Jim Capobianco, Chris Sanders, Joe Ranft, Francis Glebas",,Don Hahn,Hans Zimmer,Walt Disney Feature Animation,Buena Vista Pictures Distribution,,88 minutes,United States,English,$45 million,$978.8 million,88.0,978800000.0,45000000.0,1994-06-15,8.5,88.0,92.0,"Jonathan Taylor Thomas, Matthew Broderick, James Earl Jones, Jeremy Irons, Moira Kelly, Niketa Calame, Ernie Sabella, Nathan Lane, Robert Guillaume, Rowan Atkinson, Whoopi Goldberg, Cheech Marin, Jim Cummings, Madge Sinclair",,"June 15, 1994  ",,Ivan Bilancio,,,"Irene Mecchi, Jonathan Roberts, Linda Woolverton",,,,,,,,,,,,,,,,,,,,,,,,,,,,,,
194,Angels in the Outfield,William Dear,,"['Angels in the Outfield', '1951 film', 'by', 'Dorothy Kingsley', 'George Wells', 'Richard Conlin']","['Irby Smith', 'Joe Roth', 'Roger Birnbaum']",Randy Edelman,,Buena Vista Pictures Distribution,,102 minutes,United States,English,$31 million,$50.2 million,102.0,50200000.0,31000000.0,1994-07-15,6.2,44.0,31.0,"Danny Glover, Tony Danza, Brenda Fricker, Ben Johnson, Jay O. Sanders, Christopher Lloyd",Matthew F. Leonetti,"July 15, 1994 ",,Bruce Green,,,Holly Goldberg Sloan,,,,,,,,,,,,"['Walt Disney Pictures', 'Caravan Pictures']",,,,,,,,,,,,,,,,,,
195,Squanto: A Warrior's Tale,Xavier Koller,,,Kathryn F. Galan,Joel McNeely,Walt Disney Pictures,Buena Vista Pictures Distribution,,102 minutes,,English,,$3.3 million,102.0,3300000.0,,1994-10-28,6.1,N/A,60.0,"Adam Beach, Michael Gambon, Nathaniel Parker, Mandy Patinkin",Robbie Greenberg,"October 28, 1994 ",Darlene Craviotto,"Lisa Day, Gillian Hutshing",,,,,United StatesCanada,,,,,,,,,,,,,,,,,,,,,,,,,,,,
196,The Santa Clause,John Pasquin,,,"['Brian Reilly', 'Jeffrey Silver', 'Robert Newmyer']",Michael Convertino,,Buena Vista Pictures Distribution,"November 5, 1994",97 minutes,United States,English,$22 million,$190.3 million,97.0,190300000.0,22000000.0,1994-11-05,6.6,57.0,73.0,"Tim Allen, Judge Reinhold, Wendy Crewson, David Krumholtz, Peter Boyle",Walt Lloyd,,"['Leo Benvenuti', 'Steve Rudnick']",Larry Bock,,,,,,,,,,,,,,,"['Walt Disney Pictures', 'Hollywood Pictures', 'Outlaw Productions']",,,,,,,,,,,,,,,,,,
