,title,Directed by,Story by,Based on,Produced by,Music by,Production company,Distributed by,Release dates,Running time,Country,Language,Budget,Box office,Running time(int),Box office(float),Budget(float),Release date (Datetime),IMDb rating,Meta Score,Rotten Tomatoes (%),Starring,Cinematography,Release date,Written by,Edited by,Languages,Narrated by,Screenplay by,Adaptation by,Countries,Color process,Genre,Created by,Country of origin,No.  of seasons,No.  of episodes,Executive producers,Network,Release,Production companies,Original language,Producer,Developed by,Voices of,Theme music composer,Opening theme,Ending theme,Composer,Producers,Editor,Kanji,Transcriptions,Revised Hepburn,Traditional Chinese,Simplified Chinese,Literal meaning,Original title,Layouts by
285,Holes,Andrew Davis,,"['Holes', 'by Louis Sachar']","Andrew Davis, Lowell D. Blank, Mike Medavoy, Teresa Tucker-Davies",Joel McNeely,,"Buena Vista Pictures Distribution , Summit Entertainment ",,117 minutes,United States,English,$17 million,$71.4 million,117.0,71400000.0,17000000.0,2003-04-18,7.0,71.0,78.0,"Sigourney Weaver, Jon Voight, Patricia Arquette, Tim Blake Nelson, Shia LaBeouf",Stephen St. John,"April 18, 2003  ",,"Thomas J. Nordberg, Jeffrey Wolf",,,Louis Sachar,,,,,,,,,,,,"Walt Disney Pictures, Walden Media, Phoenix Pictures, Chicago Pacific Entertainment",,,,,,,,,,,,,,,,,,
286,The Lizzie McGuire Movie,Jim Fall,,"['Lizzie McGuire', 'by', 'Terri Minsky']",Stan Rogow,Cliff Eidelman,,Buena Vista Pictures Distribution,,94 minutes,United States,English,$17 million,$55.5 million,94.0,55500000.0,17000000.0,2003-05-02,5.5,56.0,40.0,"Hilary Duff, Adam Lamberg, Robert Carradine, Hallie Todd, Jake Thomas",Jerzy Zieliński,"May 2, 2003  ","Susan Estelle Jansen, Ed Decter, John J. Strauss",Margie Goodspeed,,,,,,,,,,,,,,,"Walt Disney Pictures, Stan Rogow Productions",,,,,,,,,,,,,,,,,,
287,Atlantis: Milo's Return,"Victor Cook, Toby Shelton, Tad Stones",,"Timaeus, by Plato",Tad Stones,Don Harper,Walt Disney Television Animation,Walt Disney Studios Motion Pictures,,70 minutes,United States,English,,,70.0,,,2003-05-20,5.1,N/A,N/A,"James Arnold Taylor, Cree Summer, John Mahoney, Jacqueline Obradors, Don Novello, Corey Burton, Phil Morris, Florence Stanley, Frank Welker, Steve Barr, Clancy Brown, Jean Gilpin, Kai R. Larsen, Bill Fagerbakke, Thomas F. Wilson, Floyd Red Crow Westerman, Jeff Bennett, W. Morgan Sheppard",,"May 20, 2003 ",,John Royer,,,"Steve Englehart, Thomas Hart, Kevin Hopps, Tad Stones, Marty Isenberg, Henry Gilroy",,,,,,,,,,,,,,,,,,,,,,,,,,,,,,
288,Finding Nemo,Andrew Stanton,Andrew Stanton,,Graham Walters,Thomas Newman,Pixar Animation Studios,Buena Vista Pictures Distribution,"May 18, 2003",100 minutes,United States,English,$94 million,$940.3 million,100.0,940300000.0,94000000.0,2003-05-18,8.2,90.0,99.0,"Albert Brooks, Ellen DeGeneres, Alexander Gould, Willem Dafoe, Geoffrey Rush, Bill Hunter","Sharon Calahan, Jeremy Lasky",,,David Ian Salter,,,"Andrew Stanton, Bob Peterson, David Reynolds",,,,,,,,,,,,,,,,,,,,,,,,,,,,,,
289,Pirates of the Caribbean:The Curse of the Black Pearl,Gore Verbinski,"Ted Elliott, Terry Rossio, Stuart Beattie, Jay Wolpert",Walt Disney's Pirates of the Caribbean,Jerry Bruckheimer,Klaus Badelt,,Buena Vista Pictures Distribution,"June 28, 2003",143 minutes,United States,English,$140 million,$654.3 million,143.0,654300000.0,140000000.0,2003-06-28,8.1,63.0,80.0,"Johnny Depp, Geoffrey Rush, Orlando Bloom, Keira Knightley, Jonathan Pryce",Dariusz Wolski,,,"Craig Wood, Stephen Rivkin, Arthur Schmidt",,,"Ted Elliott, Terry Rossio",,,,,,,,,,,,"Walt Disney Pictures, Jerry Bruckheimer Films",,,,,,,,,,,,,,,,,,
290,Freaky Friday,Mark Waters,,"['Freaky Friday', 'by', 'Mary Rodgers']",Andrew Gunn,Rolfe Kent,,Buena Vista Pictures,"August 4, 2003",97 minutes,United States,English,$26 million,$160.8 million,97.0,160800000.0,26000000.0,2003-08-04,6.3,70.0,88.0,"Jamie Lee Curtis, Lindsay Lohan, Harold Gould, Chad Michael Murray, Mark Harmon",Oliver Wood,,,Bruce Green,,,"Heather Hach, Leslie Dixon",,,,,,,,,,,,"Walt Disney Pictures, Gunn Films",,,,,,,,,,,,,,,,,,
291,Stitch! The Movie,"Tony Craig, Bobs Gannaway",,,"Tony Craig, Jess Winfield, Bobs Gannaway",Michael Tavera,Walt Disney Television Animation,Buena Vista Home Entertainment,,60 minutes,United States,English,,,60.0,,,2003-08-26,6.2,N/A,20.0,"Chris Sanders, Daveigh Chase, Jeff Bennett, David Ogden Stiers, Kevin McDonald, Kevin Michael Richardson",,"August 26, 2003 ","Roberts Gannaway, Jess Winfield",Tony Mizgalski,,,,,,,,,,,,,,,,,,,,,,,,,,,,,,,,,
292,George of the Jungle 2,David Grossman,,"['George of the Jungle', 'by', 'Jay Ward', 'Bill Scott']","['Gregg Hoffman', 'Jordan Kerner']",J. A. C. Redford,,Buena Vista Home Entertainment,,87 minutes,,English,,,87.0,,,2003-10-21,3.4,N/A,17.0,"['Thomas Haden Church', 'Christopher Showerman', 'Julie Benz', 'John Cleese', 'Christina Pickles', 'Angus T. Jones', 'Kelly Miller', 'John Kassir', 'Michael Clarke Duncan']",David Burr,"October 21, 2003 ",,Alan Cody,,,Jordan Moffet,,"['United States', 'Australia']",,,,,,,,,,"['Walt Disney Pictures', 'Walt Disney Home Entertainment', 'The Kerner Entertainment Company']",,,,,,,,,,,,,,,,,,
293,Brother Bear,"['Aaron Blaise', 'Robert Walker']",Nathan GrenoStevie Wermers-SkeltonKevin DetersWoody WoodmanThom EnriquezKevin HarkeyBroose JohnsonJohn NortonJohn Puglisi,,Chuck Williams,"['Phil Collins', 'Mark Mancina']",,Buena Vista Pictures Distribution,"October 20, 2003",85 minutes,United States,,$46 million,$250.4 million,85.0,250400000.0,46000000.0,2003-10-20,6.9,48.0,37.0,"['Joaquin Phoenix', 'Jeremy Suarez', 'Rick Moranis', 'Dave Thomas', 'Jason Raize', 'D. B. Sweeney']",,,,Tim Mertens,"['English', 'Inuktitut']",,Tab MurphyLorne CameronDavid HoseltonSteve BencichRon J. Friedman,,,,,,,,,,,,"['Walt Disney Pictures', 'Walt Disney Feature Animation']",,,,,,,,,,,,,,,,,,
294,The Haunted Mansion,Rob Minkoff,,"['The Haunted Mansion', 'by', 'Walt Disney']","Don Hahn, Andrew Gunn",Mark Mancina,Walt Disney Pictures,Buena Vista Pictures Distribution,,87 minutes,United States,English,$90 million,$182.3 million,87.0,182300000.0,90000000.0,2003-11-26,5.2,34.0,13.0,"Eddie Murphy, Terence Stamp, Wallace Shawn, Marsha Thomason, Jennifer Tilly",Remi Adefarasin,"November 26, 2003 ",David Berenbaum,Priscilla Nedd-Friendly,,,,,,,,,,,,,,,,,,,,,,,,,,,,,,,,,
295,The Young Black Stallion,Simon Wincer,Jeanne Rosenberg,"['The Young Black Stallion', 'by', 'Walter Farley', '& Steven Farley']","Fred Roos, Frank Marshall",William Ross,,Buena Vista Pictures Distribution,,50 minutes,United States,English,,$9.6 million,50.0,9600000.0,,2003-12-25,5.4,51.0,44.0,"Richard Romanus, Biana G. Tamimi, Patrick Elyas",Reed Smoot,"December 25, 2003 ",,"Bud Smith, Terry Blythe",,,Jeanne Rosenberg,,,,,,,,,,,,"Walt Disney Pictures, The Kennedy/Marshall Company",,,,,,,,,,,,,,,,,,
296,Teacher's Pet,Timothy Björklund,,"[""Teacher's Pet"", 'by', 'Gary Baseman', 'Bill Steinkellner', 'Cheri Steinkellner']",Stephen Swofford,Stephen James Taylor,,Buena Vista Pictures Distribution,,74 minutes,United States,English,$10 million,$6.5 million,74.0,6500000.0,10000000.0,2004-01-16,7.1,N/A,86.0,"Nathan Lane, Shaun Fleming, Debra Jo Rupp, Kelsey Grammer, David Ogden Stiers, Jerry Stiller, Rosalyn Landor",,"January 16, 2004 ",Bill SteinkellnerCheri Steinkellner,Nancy Frazen,,,,,,,,,,,,,,,"Walt Disney Television Animation, Toon City Animation",,,,,,,,,,,,,,,,,,
297,Miracle,Gavin O'Connor,,,Mark CiardiGordon GrayRoss GreenburgJustis GreeneJon MoneGreg O'Connor,Mark Isham,,Buena Vista Pictures Distribution,,136 minutes,United States,English,$28 million,$64.5 million,136.0,64500000.0,28000000.0,2004-02-06,7.5,68.0,81.0,Kurt RussellPatricia ClarksonNoah Emmerich,Dan Stoloff,"February 6, 2004 ",Eric GuggenheimMike Rich,John GilroyDaric Loo,,,,,,,,,,,,,,,"['Walt Disney Pictures', 'Mayhem Pictures']",,,,,,,,,,,,,,,,,,
298,The Lion King 1½,Bradley Raymond,,"['Characters created', 'by', 'Irene Mecchi', 'Jonathan Roberts', 'Linda Woolverton']",George A. Mendoza,Don L. Harper,DisneyToon Studios,Walt Disney Home Entertainment,"February 10, 2004",83 minutes,United States,English,,,83.0,,,2004-02-10,N/A,N/A,N/A,"Nathan Lane, Ernie Sabella",,,,Joyce Arrastia,,,Tom Rogers,,,,,,,,,,,,,,,,,,,,,,,,,,,,,,
299,Confessions of a Teenage Drama Queen,Sara Sugarman,,"['Confessions of a Teenage Drama Queen', 'by', 'Dyan Sheldon']","Robert Shapiro, Jerry Leider",Mark Mothersbaugh,Walt Disney Pictures,Buena Vista Pictures Distribution,,85 minutes,United States,English,$15 million,$33.3 million,85.0,33300000.0,15000000.0,2004-02-20,4.7,33.0,14.0,"Lindsay Lohan, Adam Garcia, Glenne Headly, Alison Pill, Carol Kane",Stephen H. Burum,"February 20, 2004 ",,Anita Brandt-Burgoyne,,,Gail Parent,,,,,,,,,,,,,,,,,,,,,,,,,,,,,,
300,Winnie the Pooh: Springtime with Roo,"Elliot M. Bour, Saul Andrew Blinkoff",,"['Winnie-the-Pooh', 'by', 'A. A. Milne', 'E. H. Shepard', 'A Christmas Carol', 'by', 'Charles Dickens']",John A. Smith,Mark Watters,DisneyToon Studios,Walt Disney Home Entertainment,,65 minutes,United States,English,,,65.0,,,2004-03-09,6.5,N/A,N/A,"Jimmy Bennett, Jim Cummings, John Fiedler, Peter Cullen, Ken Sansom, Kath Soucie",,"March 9, 2004 ",Tom Rogers,Robert S. Birchard,,David Ogden Stiers,,,,,,,,,,,,,,,,,,,,,,,,,,,,,,,
301,Home on the Range,"Will Finn, John Sanford","Will Finn, John Sanford, Michael LaBash, Sam Levine, Mark Kennedy, Robert Lence",,Alice Dewey Goldstone,Alan Menken,Walt Disney Feature Animation,Buena Vista Pictures Distribution,"March 21, 2004",76 minutes,United States,English,$110 million,$145.3 million,76.0,145300000.0,110000000.0,2004-03-21,5.4,50.0,52.0,"Roseanne Barr, Judi Dench, Jennifer Tilly, Cuba Gooding Jr., Randy Quaid, Steve Buscemi",,,"Will Finn, John Sanford",H. Lee Peterson,,,,,,,,,,,,,,,,,,,,,,,,,,,,,,,,,
302,Sacred Planet,"['Jon Long', 'Hairul Salleh Askor']",,,"Jon Long, Karen Fernandez Long",,,"Buena Vista Pictures, Disney Enterprises, Walt Disney Pictures",,40 minutes,,English,,$1.1 million,40.0,1100000.0,,2004-04-22,6.0,53.0,58.0,"Arapata McKay, Tsaan Ciqae, Mae Tui, Cy Peck Jr., Mutang Urud",William Reeve,"April 22, 2004 ","Karen Fernandez Long, Jon Long",Jon Long,,Robert Redford,,,"Canada, Malaysia, United States",,,,,,,,,,"Allied Films, IMAX Film Holding Co., Living Films",,,,,,,,,,,,,,,,,,
303,Around the World in 80 Days,Frank Coraci,,"['Around the World in Eighty Days', '1873 novel', 'by', 'Jules Verne']","['Bill Badalato', 'Hal Lieberman']",Trevor Jones,,"['Walt Disney Pictures', '(through', 'Buena Vista Pictures Distribution', '; United States)', 'Summit Entertainment']",,120 minutes,United States,English,$110 million,$72.2 million,120.0,72200000.0,110000000.0,2004-06-16,5.9,49.0,32.0,"Jackie Chan, Steve Coogan, Cécile de France, Jim Broadbent",Phil Meheux,"June 16, 2004 ",,Tom Lewis,,,"['David Titcher', 'David Benullo', 'David Goldstein']",,,,,,,,,,,,"['Walden Media', 'Spanknyce Films', 'Mostow/Lieberman Productions']",,,,,,,,,,,,,,,,,,
304,America's Heart and Soul,Louis Schwartzberg,,,Louis Schwartzberg,Joel McNeely,,Buena Vista Pictures Distribution,,84 minutes,United States,English,,"$314,402",84.0,314402.0,,2004-07-02,N/A,N/A,N/A,,Louis Schwartzberg,"July 2, 2004 ",,"['Brian Funck', 'Tom McGah']",,,,,,,,,,,,,,,"['Walt Disney Pictures', 'Blacklight Films']",,,,,,,,,,,,,,,,,,
305,The Princess Diaries 2:Royal Engagement,Garry Marshall,"Shonda Rhimes, Gina Wendkos","['Characters', 'by', 'Meg Cabot']","Whitney Houston, Debra Martin Chase",John Debney,,Buena Vista Pictures Distribution,,113 minutes,United States,English,$45 million,$134.7 million,113.0,134700000.0,45000000.0,2004-08-11,5.8,43.0,26.0,"Anne Hathaway, Heather Matarazzo, John Rhys-Davies, Héctor Elizondo, Julie Andrews",Charles Minsky,"August 11, 2004 ",,Bruce Green,,,Shonda Rhimes,,,,,,,,,,,,"Walt Disney Pictures, ShondaLand, Martin Chase Productions",,,,,,,,,,,,,,,,,,
306,"Mickey, Donald, Goofy: The Three Musketeers",Donovan Cook,,"['The Three Musketeers', 'by', 'Alexandre Dumas', 'Mickey Mouse', 'by', 'Walt Disney', 'and', 'Ub Iwerks']",Margot Pipkin,Bruce Broughton,Disneytoon Studios,Buena Vista Home Entertainment,,"73, minutes",United States,English,,,73.0,,,2004-08-17,6.4,N/A,36.0,"Wayne Allwine, Tony Anselmo, Bill Farmer, Russi Taylor, Tress MacNeille, Jim Cummings, April Winchell, Jeff Bennett, Maurice LaMarche, Rob Paulsen",,"August 17, 2004 ",,Bret Marnell,,,"Evan Spiliotopoulos, David M. Evans",,,,,,,,,,,,,,,,,,,,,,,,,,,,,,
307,The Incredibles,Brad Bird,,,John Walker,Michael Giacchino,,Buena Vista Pictures Distribution,"October 24, 2004",115 minutes,United States,English,$92–145 million,$631.6 million,115.0,631600000.0,92000000.0,2004-10-24,8.0,90.0,N/A,"Craig T. Nelson, Holly Hunter, Sarah Vowell, Spencer Fox, Jason Lee, Samuel L. Jackson, Elizabeth Peña","Andrew Jimenez, Patrick Lin, Janet Lucroy",,Brad Bird,Stephen Schaffer,,,,,,,,,,,,,,,"Pixar Animation Studios, Walt Disney Pictures",,,,,,,,,,,,,,,,,,
308,Mickey's Twice Upon a Christmas,Matthew O'Callaghan,"Peggy Holmes, Chad Fiveash, James Patrick Stoteraux, Theresa Pettengill, Carole Holliday, Colin Goldman, Matthew O'Callaghan","['Mickey Mouse', 'by', 'Walt Disney', 'Ub Iwerks']",Pam Marsden,Stephen James Taylor,Disneytoon Studios,Walt Disney Home Entertainment,,67 minutes,United States,English,,,67.0,,,2004-11-09,6.5,N/A,N/A,"Wayne Allwine, Tony Anselmo, Jeff Bennett, Jim Cummings, Bill Farmer, Tress MacNeille, Jason Marsden, Kellie Martin, Chuck McCann, Clive Revill, Russi Taylor, Alan Young",,"November 9, 2004 ",,"Julie Rogers, Kirk Demorest",,,"Bill Motz, Bob Roth, Peggy Holmes, Chad Fiveash, James Patrick Stoteraux, Matthew O'Callaghan, Shirley Pierce, Jim Peronto, Carole Holliday, Michael Shipley, Jim Bernstein",,,,,,,,,,,,,,,,,,,,,,,,,,,,,,
309,National Treasure,Jon Turteltaub,"Jim Kouf, Oren Aviv, Charles Segars",,"Jerry Bruckheimer, Jon Turteltaub",Trevor Rabin,,Buena Vista Pictures Distribution,,131 minutes,United States,English,$100 million,$347.5 million,131.0,347500000.0,100000000.0,2004-11-19,6.9,40.0,46.0,"Nicolas Cage, Harvey Keitel, Jon Voight, Diane Kruger, Sean Bean, Justin Bartha, Christopher Plummer",Caleb Deschanel,"November 19, 2004 ",,William Goldenberg,,,"['Jim Kouf', 'Cormac Wibberley', 'Marianne Wibberley']",,,,,,,,,,,,"Walt Disney Pictures, Jerry Bruckheimer Films, Junction Entertainment, Saturn Films",,,,,,,,,,,,,,,,,,
310,Aliens of the Deep,"James Cameron, Steven Quale",,,"James Cameron, Andrew Wight",Jeehun Hwang,,Buena Vista Pictures Distribution,,100 minutes,United States,English,,$9 million,100.0,9000000.0,,2005-01-28,6.3,71.0,84.0,"Anatoly Sagalevich, Genya Chernaiev, Victor Nischeta, Pamela G. Conrad, Jim Childress, Dijanna Figueroa","James Cameron, Vince Pace","January 28, 2005 ",,"Matthew Kregor, Fiona Wight",,,,,,,,,,,,,,,"Walt Disney Pictures, Walden Media, Earthship Productions",,,,,,,,,,,,,,,,,,
311,Mulan II,"Darrell Rooney, Lynne Southerland",,,Jennifer Blohm,Joel McNeely,,Buena Vista Home Entertainment,"November 3, 2004",79 minutes,United States,English,,,79.0,,,2004-11-03,5.7,N/A,0.0,"Ming-Na Wen, BD Wong, Gedde Watanabe, Sandra Oh, Jerry Tondo, Lauren Tom, Harvey Fierstein, Lucy Liu, Mark Moseley",,,,Pam Ziegenhagen,,,"Michael Lucker, Chris Parker, Roger S. H. Schulman",,,,,,,,,,,,"['Walt Disney Home Entertainment', 'Walt Disney Pictures', 'DisneyToon Studios']",,,,,,,,,,,,,,,,,,
312,Pooh's Heffalump Movie,Frank Nissen,,"['Characters', 'by', 'A. A. Milne']",Jessica Koplos-Miller,Joel McNeely,,Buena Vista Pictures Distribution,"February 11, 2005",68 minutes,United States,English,$20 million,$52.9 million,68.0,52900000.0,20000000.0,2005-02-11,6.4,64.0,80.0,"Jim Cummings, John Fiedler, Kath Soucie, Nikita Hopkins, Ken Sansom, Peter Cullen, Kyle Stanger, Brenda Blethyn",,,,"['Robert Fisher Jr.', 'Nancy Frazen', 'Anthony F. Rocco']",,,"Brian Hohlfeld, Evan Spiliotopoulos",,,,,,,,,,,,"['Walt Disney Pictures', 'Disneytoon Studios', 'Walt Disney Animation Japan']",,,,,,,,,,,,,,,,,,
313,The Pacifier,Adam Shankman,,,"Roger Birnbaum, Gary Barber, Jonathan Glickman",John Debney,,Buena Vista Pictures Distribution,,95 minutes,United States,English,$56 million,$198.6 million,95.0,198600000.0,56000000.0,2005-03-04,5.6,30.0,21.0,"Vin Diesel, Lauren Graham, Faith Ford, Brittany Snow, Max Thieriot, Carol Kane, Brad Garrett",Peter James,"March 4, 2005 ","Thomas Lennon, Robert Ben Garant",Christopher Greenbury,,,,,,,,,,,,,,,"Walt Disney Pictures, Spyglass Entertainment",,,,,,,,,,,,,,,,,,
314,Ice Princess,Tim Fywell,"['Meg Cabot', 'Hadley Davis']",,Bridget Johnson,Christophe Beck,,Buena Vista Pictures Distribution,,97 minutes,United States,English,$25 million,$25.7 million,97.0,25700000.0,25000000.0,2005-03-18,6.0,55.0,52.0,"['Joan Cusack', 'Kim Cattrall', 'Michelle Trachtenberg', 'Hayden Panettiere']",David Hennings,"March 18, 2005  ",,Janice Hampton,,,Hadley Davis,,,,,,,,,,,,"['Walt Disney Pictures', 'Bridget Johnson Films', 'On The Ice Productions']",,,,,,,,,,,,,,,,,,
315,Tarzan II,Brian Smith,,"['Tarzan of the Apes', 'by', 'Edgar Rice Burroughs', 'Disney’s', 'Tarzan', 'by', 'Walt Disney Animation Studios', 'Disney’s', 'The Legend of Tarzan', 'by', 'Walt Disney Television']",Carolyn BatesJim KammerudLeslie Hough,"Mark Mancina, Dave Metzger , Phil Collins ",,Buena Vista Home Entertainment,,72 minutes,United States,English,,,72.0,,,2005-06-14,N/A,N/A,N/A,Harrison ChadBrenda GrateHarrison FahnGeorge CarlinEstelle HarrisBrad GarrettRon PerlmanGlenn CloseLance Henriksen,,"June 14, 2005 ",,"Ron Price, John Royer",,,"['Bob Tzudiker', 'Noni White', 'Jim Kammerud', 'Brian Smith']",,,,,,,,,,,,"DisneyToon Studios, Toon City Animation",,,,,,,,,,,,,,,,,,
316,Herbie: Fully Loaded,Angela Robinson,"Thomas Lennon, Robert Ben Garant, Mark Perez","['Characters', 'by Gordon Buford']",Robert Simonds,Mark Mothersbaugh,,Buena Vista Pictures Distribution,"May 10, 2005",101 minutes,United States,English,$50 million,$144.1 million,101.0,144100000.0,50000000.0,2005-05-10,4.9,47.0,41.0,"Lindsay Lohan, Justin Long, Breckin Meyer, Matt Dillon, Michael Keaton",Greg Gardiner,,,Wendy Greene Bricmont,,,"Thomas Lennon, Robert Ben Garant, Alfred Gough, Miles Millar",,,,,,,,,,,,"Walt Disney Pictures, Robert Simonds Productions, Millar Gough Ink ",,,,,,,,,,,,,,,,,,
317,Howl's Moving Castle,Hayao Miyazaki,,"[""Howl's Moving Castle"", 'by', 'Diana Wynne Jones']",Toshio Suzuki,Joe Hisaishi,Studio Ghibli,Toho,5 September 2004,119 minutes,Japan,Japanese,2.4 billion US$24 million,23.2 billion US$236 million ,119.0,23200000000.0,2400000000.0,2004-09-05,8.2,82.0,87.0,"Chieko Baisho, Takuya Kimura, Akihiro Miwa",Atsushi Okui,,,Takeshi Seyama,,,Hayao Miyazaki,,,,,,,,,,,,,,,,,,,,,,,ハウルの動く城,TranscriptionsRevised HepburnHauru no Ugoku Shiro,Hauru no Ugoku Shiro,,,,,
318,Sky High,Mike Mitchell,,,Andrew Gunn,Michael Giacchino,,Buena Vista Pictures Distribution,,100 minutes,United States,English,$35 million,$86.4 million,100.0,86400000.0,35000000.0,2005-07-29,6.3,62.0,73.0,"Kelly Preston, Michael Angarano, Danielle Panabaker, Mary Elizabeth Winstead, Kurt Russell",Shelly Johnson,"July 29, 2005 ","Paul Hernandez, Bob Schooley, Mark McCorkle",Peter Amundson,,,,,,,,,,,,,,,"Walt Disney Pictures, Gunn Films",,,,,,,,,,,,,,,,,,
319,Valiant,Gary Chapman,George Webster,,John H. Williams,George Fenton,,"Entertainment Film Distributors , Walt Disney Pictures , Odyssey Entertainment ","March 25, 2005",76 minutes,,,$35 million,$61.7 million,76.0,61700000.0,35000000.0,2005-03-25,5.5,45.0,32.0,"Ewan McGregor, Ricky Gervais, Tim Curry, Jim Broadbent, Hugh Laurie, John Cleese, John Hurt, Pip Torrens, Rik Mayall, Olivia Williams",,,,Jim Stewart,"['English', 'French', 'German']",,"['Jordan Katz', 'George Webster', 'George Melrod']",,"['United Kingdom', 'United States']",,,,,,,,,,"Vanguard Animation, Ealing Studios, UK Film Council, Odyssey Entertainment, Take Film Partnerships",,,,,,,,,,,,,,,,,,
320,Lilo & Stitch 2: Stitch Has a Glitch,"Tony Leondis, Michael LaBash",,,Christopher Chase,Joel McNeely,,Walt Disney Home Entertainment,,68 minutes,United States,English,,,68.0,,,2005-08-30,6.3,N/A,40.0,"Chris Sanders, Dakota Fanning, Tia Carrere, Kevin McDonald, David Ogden Stiers, Jason Scott Lee",,"August 30, 2005 ","Tony Leondis, Michael LaBash, Eddie Guzelian, Alexa Junge",William J. Caparella,,,,,,,,,,,,,,,"Disneytoon Studios, Walt Disney Pictures",,,,,,,,,,,,,,,,,,
321,Pooh's Heffalump Halloween Movie,"Elliot M. Bour, Saul Andrew Blinkoff",,"['Characters created', 'by', 'A. A. Milne']",John A. Smith,Mark Watters,DisneyToon Studios,Walt Disney Home Entertainment,,67 minutes,United States,English,,,67.0,,,2005-09-13,6.6,N/A,N/A,"Jimmy Bennett, Kyle Stanger, Jim Cummings, John Fiedler, Peter Cullen, Ken Sansom, Kath Soucie",,"September 13, 2005 ","Evan Spiliotopoulos, Brian Hohlfeld",Art Noda,,David Ogden Stiers,,,,,,,,,,,,,,,,,,,,,,,,,,,,,,,
322,The Greatest Game Ever Played,Bill Paxton,,"['The Greatest Game Ever Played: A True Story', 'by Mark Frost']","['David Blocker', 'Larry Brezner', 'Mark Frost']",Brian Tyler,Walt Disney Pictures,Buena Vista Pictures Distribution,,120 minutes,United States,English,$25 million,$15.4 million,120.0,15400000.0,25000000.0,2005-09-30,7.4,55.0,63.0,"['Shia LaBeouf', 'Stephen Dillane', 'Peter Firth', 'Elias Koteas']",Shane Hurlbut,"September 30, 2005 ",,Elliot Graham,,,Mark Frost,,,,,,,,,,,,,,,,,,,,,,,,,,,,,,
323,Chicken Little,Mark Dindal,"Mark Dindal, Mark Kennedy","""Henny Penny""",Randy Fullmer,John Debney,,Buena Vista Pictures Distribution,"October 30, 2005",81 minutes,United States,English,$150 million,$314.4 million,81.0,314400000.0,150000000.0,2005-10-30,5.7,48.0,37.0,"Zach Braff, Joan Cusack, Dan Molina, Steve Zahn, Garry Marshall, Amy Sedaris, Mark Walton, Don Knotts",,,,Dan Molina,,,"Steve Bencich, Ron J. Friedman, Ron Anderson",,,,,,,,,,,,"Walt Disney Feature Animation, Walt Disney Pictures",,,,,,,,,,,,,,,,,,
324,"The Chronicles of Narnia:The Lion, the Witch and the Wardrobe",Andrew Adamson,,"['The Lion, the Witch and the Wardrobe', 'by', 'C. S. Lewis']","Mark Johnson, Phillip Steuer",Harry Gregson-Williams,,Buena Vista Pictures Distribution,7 December 2005,143 minutes,,English,$180 million,$745 million,143.0,745000000.0,180000000.0,2005-12-07,6.9,75.0,75.0,"William Moseley, Anna Popplewell, Skandar Keynes, Georgie Henley, Tilda Swinton, James McAvoy, Jim Broadbent, Liam Neeson",Donald McAlpine,,,"Sim Evan-Jones, Jim May",,,"['Ann Peacock', 'Andrew Adamson', 'Christopher Markus', 'Stephen McFeely']",,"United Kingdom, United States",,,,,,,,,,"Walt Disney Pictures, Walden Media, Mark Johnson Productions",,,,,,,,,,,,,,,,,,
325,Kronk's New Groove,"['Elliot M. Bour', 'Saul Andrew Blinkoff']","['Anthony Leondis', 'Michael LaBash']","[""The Emperor's New Groove"", 'by', 'Mark Dindal']","['Prudence Fenton', 'John A. Smith']","['Mark Watters', 'Jeanine Tesori']",,Buena Vista Home Entertainment,,72 minutes,United States,English,,,72.0,,,2005-12-13,5.8,N/A,0.0,"['Patrick Warburton', 'Tracey Ullman', 'Eartha Kitt', 'John Goodman', 'Wendie Malick', 'John Mahoney', 'John Fiedler', 'David Spade']",,"December 13, 2005 ",,"['Philip Malamuth', 'Arthur D. Noda']",,David Spade,Tom Rogers,,,,,,,,,,,,"['Walt Disney Home Entertainment', 'Walt Disney Pictures', 'DisneyToon Studios']",,,,,,,,,,,,,,,,,,
326,Glory Road,James Gartner,,,Jerry Bruckheimer,Trevor Rabin,,Buena Vista Pictures Distribution,,118 minutes,United States,English,$30 million,$42.9 million,118.0,42900000.0,30000000.0,2006-01-13,7.2,58.0,N/A,"Josh Lucas, Derek Luke, Jon Voight","John Toon, Jeffrey L. Kimball","January 13, 2006 ","Chris Cleveland, Bettina Gilois","John Wright, Jason Hellmann",,,,,,,,,,,,,,,"Walt Disney Pictures, Jerry Bruckheimer Films, Texas Western Productions, Glory Road Productions",,,,,,,,,,,,,,,,,,
327,Roving Mars,George Butler,,,"['George Butler', 'Frank Marshall']","['Philip Glass', 'Sigur Rós']",,Buena Vista Pictures Distribution,,40 minutes,United States,English,$1 million,$11 million,40.0,11000000.0,1000000.0,2006-01-27,7.2,58.0,71.0,,T.C. Christensen,"January 27, 2006 ","['Robert Andrus', 'George Butler']",Nancy Baker,,Paul Newman ,,,,,,,,,,,,,"['Walt Disney Pictures', 'White Mountain Films', 'The Kennedy/Marshall Company']",,,,,,,,,,,,,,,,,,
328,Bambi II,Brian Pimental,"Brian Pimental, Jeanne Rosenberg","['Characters created', 'by', 'Felix Salten']","Jim Ballantine, Jeffrey Moznett, Dave Okey",Bruce Broughton,DisneyToon Studios,"Buena Vista International , Walt Disney Home Entertainment ","January 26, 2006",69 minutes,,English,,$35 million,69.0,35000000.0,,2006-01-26,N/A,N/A,N/A,"Alexander Gould, Patrick Stewart, Brendon Baerg, Nicky Jones, Andrea Bowen, Anthony Ghannam, Cree Summer, Keith Ferguson, Makenna Cowgill, Emma Rose Lima, Ariel Winter, Brian Pimental, Carolyn Hennesy, Mary Day, Alexis Restrum",,,,"Jeremy Milton, Mark Solomon",,,Alicia Kirk,,"['United States', 'Australia']",,,,,,,,,,,,,,,,,,,,,,,,,,,,
329,Eight Below,Frank Marshall,,"['Antarctica', 'by', 'Toshirô Ishidô', 'Koreyoshi Kurahara', 'Tatsuo Nogami', 'Susumu Saji']","Patrick Crowley, David Hoberman",Mark Isham,,Buena Vista Pictures Distribution,,120 minutes,United States,English,$40 million,$120.5 million,120.0,120500000.0,40000000.0,2006-02-17,7.3,64.0,73.0,"Paul Walker, Bruce Greenwood, Moon Bloodgood, Jason Biggs",Don Burgess,"February 17, 2006  ",,Christopher Rouse,,,David DiGillio,,,,,,,,,,,,"Walt Disney Pictures, Spyglass Entertainment, Mandeville Films, The Kennedy/Marshall Company, Vertigo Entertainment",,,,,,,,,,,,,,,,,,
